ID,NAME,URL,WEBLAUNCHYEAR,PRIMEPHASEALPHA,PRIMEPHASENUMBER,FUNCTIONFREE,UI_FUNCTIONFREE,FUNCTIONCONTROLLLED,G-E-O-CATEGORY,UI_GEOCATEGORY,TWITTERACCOUNT,TWITTERFOLLOW_LATEST,ACTIVEPRE,ACTIVEDIS,ACTIVEANA,ACTIVEWRI,ACTIVEPUB,ACTIVEOUT,ACTIVEASS
1267,OSF (Open Science Framework),https://osf.io,2013,project management/planning,0,"open network of research documents, version control system, collaboration software, project management and registering; badges? also: commenting",NA,open project management,G,upload preprint. Prereg challenge: https://osf.io/prereg/,https://twitter.com/OSFramework,7859,V,V,V,V,V,V,V
1590,AsPredicted,https://aspredicted.org/,2015,project management/planning,0,standardized preregistration form + platform,NA,preregistration platform,G,NA,no account,NA,V,NA,NA,NA,NA,NA,NA
1542,DMP Tool,https://dmptool.org/,2011,project management/planning,0,create data mangement plans,NA,project management,E,NA,https://twitter.com/TheDMPTool,584,V,NA,NA,NA,NA,NA,NA
1268,Projects,https://projects.ac/,2013,project management/planning,0,science project management; manage experiments and data,NA,project management,E,NA,https://twitter.com/projects,899,NA,NA,V,NA,NA,NA,NA
1477,Confluence (Atlassian),https://www.atlassian.com/software/confluence,2003,project management/planning,0,team collaboration/planning,NA,project management,E,only for inside jobs for a team,https://twitter.com/Confluence,13.8K,V,NA,NA,NA,NA,NA,NA
1478,Innocentive,http://www.innocentive.com/,2001,crowdsource/define research priorities/ideas/collaborations,1,"crowdsourced innovation 
",NA,connect researchers to research,E/O,NA,https://twitter.com/InnoCentive,10.5K,V,NA,NA,NA,NA,NA,NA
1479,DHcommons,http://dhcommons.org/,2010,crowdsource/define research priorities/ideas/collaborations,1,digital humanities platform matching projects to researchers,NA,connect researchers to research,O/E,NA,https://twitter.com/DHCommons,2495,V,NA,NA,NA,NA,NA,NA
1543,Syneratio,https://syneratio.com,2012,crowdsource/define research priorities/ideas/collaborations,1,crowdfunding and collaboration,NA,"crowdfunding platform, and more",E/O,registered,https://twitter.com/Syneratio,2394,V,V,V,NA,NA,NA,NA
1341,LinkNovate,http://www.linknovate.com/,2014,crowdsource/define research priorities/ideas/collaborations,1,"Find experts, technology, innovative startups through non-pub sources",NA,experts search engine,E,NA,https://twitter.com/linknovate,12.4K,NA,V,NA,NA,NA,NA,NA
1158,Direct2experts,http://direct2experts.org/,2010,crowdsource/define research priorities/ideas/collaborations,1,A federated national (US) network of research networks in biomedicine,NA,experts search engine,E,NA,no account,NA,V?,V?,NA,NA,NA,V,NA
1070,Scholar Universe,http://www.scholaruniverse.com/,2005,crowdsource/define research priorities/ideas/collaborations,1,find experts,NA,experts search engine,E,"tried to register, takes one week",no account,NA,V,NA,NA,NA,NA,NA,NA
1585,AcademicLabs,http://www.academiclabs.co/,2015,researcher profiling (& social network),1,Facilitate research (group) collaboration & find matches,NA,matching network,E,NA,https://twitter.com/academiclabsco,386,NA,NA,NA,NA,NA,NA,NA
1389,Journal of Brief Ideas,http://beta.briefideas.org/,2015,crowdsource/define research priorities/ideas/collaborations,1,citable online index of research ideas available for public scrutiny,NA,research ideas search engine,O/E,NA,no account,NA,NA,V,NA,NA,NA,V,NA
1634,Kolabtree,https://www.kolabtree.com/,2015,crowdsource/define research priorities/ideas/collaborations,1,platform to hire freelance researchers for short-term projects,NA,connect researchers to research,E,NA,https://twitter.com/kolabtree,2508,V,NA,NA,NA,NA,NA,NA
1402,Thinklab,http://thinklab.com/,2015,fund / get contract,1,"Open Science platform where researchers and commenters can get paid
",NA,connect researchers to research,O/E,NA,https://twitter.com/thinklab,154,V,NA,NA,NA,NA,NA,NA
1159,Kaggle,https://www.kaggle.com/,2010,fund / get contract,2,connect data scientists to (commercial) market; open code competitions; jobs,NA,contract competition,E,NA,https://twitter.com/kaggle,67.2K,V,NA,NA,NA,NA,NA,NA
1336,Walacea,http://walacea.com/,2014,fund / get contract,2,crowdfunding,NA,crowdfunding platform,E,NA,https://twitter.com/walacea_,6,V,NA,NA,NA,NA,NA,NA
1187,Petridish,http://www.petridish.org/,2011,fund / get contract,2,curated platform of science projects for crowdfunding,NA,crowdfunding platform,E,NA,https://twitter.com/petridishorg,1062,V,NA,NA,NA,NA,NA,NA
1482,Endeavorist,https://www.endeavorist.org,2014,fund / get contract,2,matching research and funds/grants,NA,crowdfunding platform,E/G,NA,https://twitter.com/EndeavoristOrg,7063,V,NA,NA,NA,NA,NA,NA
1269,Consano,https://www.consano.org/,2013,fund / get contract,2,non-profit curated crowdfunding for medical research projects,NA,crowdfunding platform,E,NA,https://twitter.com/Consano,1237,V,NA,NA,NA,NA,NA,NA
1136,SciFlies,http://sciflies.org/,2009,fund / get contract,2,"Organizes crowdfunding
",NA,crowdfunding platform,E,NA,https://twitter.com/SciFlies,190,V,NA,NA,NA,NA,NA,NA
1186,Experiment.com,https://experiment.com/,2011,fund / get contract,2,platform for projects looking for crowdfunding,NA,crowdfunding platform,E,NA,no account,NA,V,NA,NA,NA,NA,NA,NA
1481,Thinkable.org,https://thinkable.org/,2014,fund / get contract,2,"promote open & fundamental research through funding, prizes and sponsorhsips",NA,crowdfunding platform,"G/E
",NA,https://twitter.com/thinkable_org,4465,V,NA,NA,NA,NA,NA,NA
1111,My Projects,http://myprojects.cancerresearchuk.org/,2008,fund / get contract,2,"showcase of research projects, public can choose which to donate to",NA,crowdfunding platform,E,NA,https://twitter.com/MyProjects,960,V,NA,NA,NA,NA,NA,NA
1483,SciFund,"http://scifundchallenge.org/
",2012,fund / get contract,2,support researchers in crowdfunding and science outreach activities,NA,crowdfunding platform,E/O,NA,https://twitter.com/SciFund,1231,V,NA,NA,NA,NA,V,NA
1026,Research Professional,http://info.researchprofessional.com/,2000,fund / get contract,2,finding funders,NA,funder search,E,registration impossible,https://twitter.com/ResearchRes,36,V,NA,NA,NA,NA,NA,NA
1221,Pivot,http://pivot.cos.com/,2012,fund / get contract,2,finding funders,NA,funder search,E,NA,no account,NA,V,NA,NA,NA,NA,NA,NA
1270,Foundation Directory,https://fconline.foundationcenter.org/,2013,fund / get contract,2,finding funders,NA,funder search,E,NA,https://twitter.com/fdncenter,130K,V,NA,NA,NA,NA,NA,NA
1272,Newton's list,http://newtonslist.crdfglobal.org/,2013,fund / get contract,2,finding funders,NA,funder search,E,NA,https://twitter.com/crdfglobal,2095,V,NA,NA,NA,NA,NA,NA
1036,Grants.gov,http://www.grants.gov/,2002,fund / get contract,2,overview of US grants,NA,funder search,E,NA,https://twitter.com/Grantsdotgov,4429,V,NA,NA,NA,NA,NA,NA
1480,Grant Forward,https://www.grantforward.com,2012,fund / get contract,2,Search engine for research grants,NA,funder search,E,NA,https://twitter.com/GrantForward,5,V,NA,NA,NA,NA,NA,NA
1271,Fundref search,http://search.crossref.org/fundref,2013,fund / get contract,2,Search research funding organisations,NA,funder search,E,NA,no account,NA,V,NA,NA,NA,NA,NA,NA
1076,WorldCat,http://www.worldcat.org/,2006,search (lit/data/patents/code),3,"search books, articles and more; find holding libraries",NA,collated library catalogue search engine,E,NA,https://twitter.com/worldcatorg [account changed],NA,NA,V,NA,NA,NA,NA,NA
1278,Standard Analytics,http://www.standardanalytics.io/,2013,search (lit/data/patents/code),3,"making scientific information (from articles/databases) machine readable and API-accessible, adding linked data and semantic enhancements",NA,enhancing bibliographic records,E,NA,no account,NA,NA,V,V?,NA,V?,NA,NA
1399,Crossref Simple Text Query,http://www.crossref.org/SimpleTextQuery/,2006,search (lit/data/patents/code),3,Batch retrieving DOI's based on free style bibliography,NA,extracting metadata,E,NA,no account,NA,NA,V,NA,NA,NA,NA,NA
1039,nanoHUB,https://nanohub.org/,2002,search (lit/data/patents/code),3,"centralized platform for computational nanotechnology research, education, and collaboration",NA,field specific search engine,E,NA,https://twitter.com/nanoHUBnews,1948,NA,V,V,NA,NA,NA,NA
1013,PubMed,https://www.ncbi.nlm.nih.gov/pubmed/,1997,search (lit/data/patents/code),3,discovery tool for biomedical sciences,NA,field specific search engine,E,NA,https://twitter.com/ncbi_pubmed,22.3K,NA,V,NA,NA,NA,NA,NA
1540,Refindit,http://www.refindit.org/,2014,search (lit/data/patents/code),3,metasearch engine for life sciences,NA,field specific search engine,E,NA,https://twitter.com/findrefsfast,1,NA,V,NA,NA,NA,NA,NA
1112,Neuroscience Information Framework,https://www.neuinfo.org/,2008,search (lit/data/patents/code),3,"neuroscience information, tools, data or materials, stands, ontology",NA,field specific search engine,E,NA,https://twitter.com/neuinfo,41.3K,NA,V,NA,NA,NA,NA,NA
1574,PubPsych,http://www.pubpsych.eu/,2013,search (lit/data/patents/code),3,"search psychological literature, mainly European",NA,field specific search engine,E,NA,https://twitter.com/PubPsych,164,NA,V,NA,NA,NA,NA,NA
1276,Scicurve,http://scicurve.com/,2013,search (lit/data/patents/code),3,Visual exploration of PubMed literature records,NA,field specific search engine,E,NA,https://twitter.com/scicurve,4891,NA,V,NA,NA,NA,NA,NA
1017,CiteSeer(X),http://citeseerx.ist.psu.edu/,1998,search (lit/data/patents/code),3,"bibliographical database, citation enhanced",NA,"field specific search engine, citation enhanced",E,NA,https://twitter.com/CiteSeerX,39,NA,V,NA,NA,NA,NA,NA
1001,Medline,https://www.nlm.nih.gov/pubs/factsheets/medline.html,1964,search (lit/data/patents/code),3,index of medical literature,NA,"field specific search engine, citation enhanced",E,NA,no account,NA,NA,V,NA,NA,NA,NA,NA
1014,RepEc (Research papers in Economics),http://repec.org/,1997,search (lit/data/patents/code),3,online bibliographic database for economics,NA,"field specific search engine, citation enhanced",E,NA,no account,NA,NA,V,NA,NA,NA,NA,NA
1114,PubGet,http://pubget.com/,2008,search (lit/data/patents/code),3,Search engine for life-science PDFs,NA,"field specific search engine, citation enhanced",E,NA,https://twitter.com/pubget,1699,NA,V,NA,NA,NA,NA,NA
1056,GoPubMed,http://www.gopubmed.com/web/gopubmed/,2004,search (lit/data/patents/code),3,semantic search using MEDLINE corpus,NA,"field specific search engine, citation enhanced",E,NA,no account,NA,NA,V,NA,NA,NA,NA,NA
1139,Quertle,http://quertle.com/,2009,search (lit/data/patents/code),3,semantic search using MEDLINE corpus,NA,"field specific search engine, citation enhanced",E,NA,https://twitter.com/Quertle,462,NA,V,NA,NA,NA,NA,NA
1138,PhilPapers,http://philpapers.org/,2009,search (lit/data/patents/code),3,"comprehensive citation enhanced search, archive & community for philosophy",NA,"field specific search engine, collaborative",E,NA,no account,NA,NA,V,NA,NA,V,V,(V)
1392,Open Commons of Phenomenology,http://ophen.org,2015,search (lit/data/patents/code),3,"Create open bibliographic register of phenomenological literature. Planned: full-text search, citation indexing, timeline and network visualisations, online annotations, ratings",NA,"field specific search engine, collaborative",O,NA,https://twitter.com/OpenPheno,1093,NA,V,NA,NA,NA,NA,NA
1484,Chemspider,http://www.chemspider.com/,2007,search (lit/data/patents/code),3,search chemical structures by name and structure,NA,"field specific search engine, for chemical structures",E,NA,https://twitter.com/ChemSpider,3297,NA,V,NA,NA,NA,NA,NA
1486,COD,http://www.crystallography.net/,2003,search (lit/data/patents/code),3,"Open-access collection of crystal structures of organic, inorganic, metal-organic compounds and minerals",NA,"field specific search engine, for crystal structures",E/O,NA,no account,NA,NA,V,NA,NA,NA,NA,NA
1538,DocGraph - Linea,http://linea.docgraph.org/,2015,search (lit/data/patents/code),3,"community open data platform to discover, aggregate and enrich new open healthcare datasets",NA,"field specific search engine, for data","O/E
",NA,https://twitter.com/DocGraph,731,NA,V,NA,NA,V,NA,NA
1539,One Repo,http://onerepo.net/,2015,search (lit/data/patents/code),3,"demo of database for all content of eventually all the world’s repositories,in uniform format, freely accessible to all as a set of web services and as harvestable data",NA,"field specific search engine, for data",O,NA,no account,NA,NA,V,NA,NA,NA,NA,NA
1591,CERN Open Data,http://opendata.cern.ch/,2014,search (lit/data/patents/code),3,find (and use) CERN data,NA,"field specific search engine, for data",O,NA,no account,NA,NA,V,V,NA,NA,NA,NA
1160,DataBank,http://data.worldbank.org/,2010,search (lit/data/patents/code),3,free economic/social data from World Bank,NA,"field specific search engine, for data",O,NA,https://twitter.com/worldbankdata,39.1K,NA,V,NA,NA,NA,NA,NA
1490,EurekaMag,http://eurekamag.com/,1998,search (lit/data/patents/code),3,"search engine for natural science literature pre-2000, including reports, reviews, meeting; uploading full-text encouraged",NA,"field specific search engine, for natural science",E/O,NA,https://twitter.com/EurekaMag,4741,NA,V,NA,NA,NA,NA,NA
1223,SciBite,http://scibite.com,2012,search (lit/data/patents/code),3,using text-mining to track latest news in pharma/biotech (in-company and free search interface),NA,"field specific search engine, for news",E,NA,https://twitter.com/Scibite,398,NA,V,NA,NA,NA,NA,NA
1004,GenBank,http://www.ncbi.nlm.nih.gov/genbank/,1982,search (lit/data/patents/code),3,"annotated collection of all publicly available DNA sequences, provided by NCBI",NA,"field specific search engine, searching DNA sequences",E,NA,no account,NA,NA,V,NA,NA,NA,NA,NA
1191,OpenPHACTS,http://www.openphacts.org/,2011,search (lit/data/patents/code),3,open access innovation platform for drug discovery via a semantic web approach,NA,"field specific search engine, searching economic data",O,NA,https://twitter.com/Open_PHACTS,1197,NA,V,NA,NA,NA,NA,NA
1340,Expernova,https://en.expernova.com,2014,search (lit/data/patents/code),3,search engine for innovation,NA,"field specific search engine, searching experts and companies",E,NA,https://twitter.com/Expernova,564,NA,V,NA,NA,NA,NA,NA
1487,PaleoBioDB,https://paleobiodb.org,2000,search (lit/data/patents/code),3,"provide global, collection-based occurrence and taxonomic data for organisms of all geological ages, as well data services to allow easy access to data for independent development of applications",NA,"field specific search engine, searching taxonomic data of organisms",E/O,NA,https://twitter.com/PaleoDB,2027,NA,V,NA,NA,NA,NA,NA
1532,Yale Image Finder,http://krauthammerlab.med.yale.edu/imagefinder,2008,search (lit/data/patents/code),3,search OA images and figures in PubMedCentral  by searching text within images,NA,"field specific search engine, searching text in images",E/O,NA,no account,NA,NA,V,NA,NA,NA,NA,NA
1071,MEDIE,http://www.nactem.ac.uk/medie/search.cgi,2005,search (lit/data/patents/code),3,retrieving biomedical correlations from medline,NA,"field specific search engine, semantic",E,NA,no account,NA,NA,V,NA,NA,NA,NA,NA
1529,JournalMap,https://journalmap.org/,2010,search (lit/data/patents/code),3,Search (environmental) literature based on geolocation,NA,"field specific search engine, with geolocations",E,NA,https://twitter.com/JournalMap,265,NA,V,NA,NA,NA,NA,NA
1440,OALib (search),http://www.oalib.com,2013,search (lit/data/patents/code),3,aggregate and index scholarly OA publications,NA,"full text OA aggregation, multidisciplinary",O/E,NA,https://twitter.com/OalibJ,68,NA,V,NA,NA,V,NA,NA
1277,Scilit,http://www.scilit.net,2013,search (lit/data/patents/code),3,FT OA aggragation,NA,"full text OA aggregation, multidisciplinary",E,NA,no account,NA,NA,V,NA,NA,NA,NA,NA
1342,Paperity,http://paperity.org/,2014,search (lit/data/patents/code),3,multidisciplinary OA aggragation,NA,"full text OA aggregation, multidisciplinary",O,NA,https://twitter.com/Paperity,1299,NA,V,NA,NA,NA,NA,NA
1390,Libraccess,http://libraccess.org/,2015,search (lit/data/patents/code),3,"Not-for-profit platform, international and interdisciplinary, full text aggregating open access resources across repositories, to make them widely available.",NA,"full text OA aggregation, multidisciplinary",O,NA,https://twitter.com/Libraccess,161,NA,V,NA,NA,NA,NA,NA
1400,Science Open articles/authors,https://www.scienceopen.com/,2014,search (lit/data/patents/code),3,"OA aggragation, multi-field, with post publication peer review",NA,"full text OA aggregation, multidisciplinary",O,NA,https://twitter.com/Science_Open,6889,NA,V,NA,NA,NA,NA,NA
1343,ResearchPad,http://researchpad.co/,2014,search (lit/data/patents/code),3,OA search engine/ePub reader,NA,"full text OA aggregation, multidisciplinary",O/E,NA,https://twitter.com/researchpad,9,NA,V,NA,NA,NA,NA,NA
1093,DBpedia,http://wiki.dbpedia.org/,2007,search (lit/data/patents/code),3,crowdsourced extraction of structured information from Wikipedia,NA,machine readable references,E,NA,no account,NA,NA,V,NA,NA,NA,NA,NA
1054,CitEc (Citations in Economics),http://citec.repec.org/,2004,search (lit/data/patents/code),3,extracting references and citation from economics publications,NA,machine readable references,E,NA,https://twitter.com/repecCitEc,106,NA,V,NA,NA,NA,NA,NA
1189,JISC Open Citations,http://opencitations.net/,2011,search (lit/data/patents/code),3,making references available,NA,machine readable references,E,NA,https://twitter.com/dshotton,223,NA,V,NA,NA,NA,NA,V
1038,Metalib,http://www.exlibrisgroup.com/category/MetaLibOverview,2002,search (lit/data/patents/code),3,federated search,NA,metasearch engine,E,NA,no account,NA,NA,V,NA,NA,NA,NA,NA
1530,JSTOR,http://www.jstor.org/,1995,search (lit/data/patents/code),3,"database of journal articles, books and primary sources; some public domain material, back files",NA,multidisciplinary search engine,E,NA,https://twitter.com/JSTOR,39.6K,NA,V,NA,NA,NA,NA,NA
1485,Research-o-Matic,http://www.researchomatic.com/,2011,search (lit/data/patents/code),3,"e-library of academic research material (essays, book notes, AP notes, term papers, research papers, theses, assignments & dissertations)",NA,multidisciplinary search engine,E,NA,https://twitter.com/Researchomatic,15.7K,NA,V,NA,NA,NA,NA,NA
1570,Recherche Isidore,http://www.rechercheisidore.fr/,2010,search (lit/data/patents/code),3,Integrated search of archives & repositories for SSH search (French),NA,multidisciplinary search engine,E,NA,https://twitter.com/rech_isidore,2996,NA,V,NA,NA,NA,NA,NA
1623,Worldwidescience,http://worldwidescience.org/,2007,search (lit/data/patents/code),3,Metasearch of scholarly databases,NA,multidisciplinary search engine,E,NA,https://twitter.com/WorldWideScienc,233,NA,V,NA,NA,NA,NA,NA
1445,Hathi,https://www.hathitrust.org/,2008,search (lit/data/patents/code),3,preserve and disseminate collections of partner institutions in digital form,NA,multidisciplinary search engine,E,NA,https://twitter.com/hathitrust,9592,NA,V,NA,NA,NA,NA,NA
1569,Baidu Scholar,http://xueshu.baidu.com/,2014,search (lit/data/patents/code),3,scholarly search engine (Chinese),NA,multidisciplinary search engine,E,NA,no account,NA,NA,V,NA,NA,NA,NA,NA
1444,Europeana,http://www.europeana.eu,2008,search (lit/data/patents/code),3,search documents and artefacts from the European heritage institutions,NA,multidisciplinary search engine,E,NA,https://twitter.com/Europeanaeu,27.4K,NA,V,NA,NA,NA,NA,NA
1443,Open Grey,http://www.opengrey.eu/,2011,search (lit/data/patents/code),3,"search grey literature (in Europe), data from 1950s onwards",NA,multidisciplinary search engine,O/E,NA,https://twitter.com/GreyLitNet,1250,NA,V,NA,NA,NA,NA,NA
1631,Iris.ai,https://iris.ai/,2016,search (lit/data/patents/code),3,"automatically extract information from scientific papers, explore related research from 30 M OA papers",NA,multidisciplinary search engine for finding conceptually related information,E,Language research,https://twitter.com/TheIrisAI,726,NA,V,NA,NA,NA,NA,NA
1002,Science Citation Index (Web of Science),http://wokinfo.com/,1964,search (lit/data/patents/code),3,citation index,NA,"multidisciplinary search engine, citation enhanced",E,NA,https://twitter.com/webofscience,12.4K,NA,V,NA,NA,NA,NA,V
1137,Microsoft Academic Search (MAS),http://academic.research.microsoft.com/,2009,search (lit/data/patents/code),3,citation index,NA,"multidisciplinary search engine, citation enhanced",E,NA,https://twitter.com/MSFTAcademic,1447,NA,V,NA,NA,NA,V,V
1568,Science Open Citation Index,https://www.scienceopen.com/,2015,experiment & collect/mine/extract data,3,citation index underlying Science Open database,NA,"multidisciplinary search engine, citation enhanced",E,NA,no account,NA,NA,V,NA,NA,NA,NA,NA
1057,Scopus,http://www.scopus.com,2004,search (lit/data/patents/code),3,citation indexing,NA,"multidisciplinary search engine, citation enhanced",E,NA,https://twitter.com/Scopus,21.4K,NA,V,NA,NA,NA,NA,(V)
1055,Google Scholar,http://scholar.google.com/,2004,search (lit/data/patents/code),3,index of scholarly publications,NA,"multidisciplinary search engine, citation enhanced",E/O,NA,no account,NA,NA,V,NA,NA,NA,NA,NA
1600,Semantic Scholar,https://www.semanticscholar.org/,2015,search (lit/data/patents/code),3,semantic search engine for (OA?) computer science papers,NA,"multidisciplinary search engine, citation enhanced",E,NA,no account,NA,NA,V,NA,NA,NA,NA,NA
1337,BookGenie451,http://www.bookgenie451.com,2014,search (lit/data/patents/code),3,discovering books & more,NA,"multidisciplinary search engine, for books",E,NA,https://twitter.com/BookGenie451,21,NA,V,NA,NA,NA,NA,NA
1560,Research Data Switchboard,http://rd-switchboard.net/,2015,search (lit/data/patents/code),3,"Find connections between research datasets across ANDS, Dryad, CERN and other international repositories",NA,"multidisciplinary search engine, for data",E,NA,no account,NA,NA,V,NA,NA,NA,NA,NA
1601,SHARE Notify,https://osf.io/share,2015,search (lit/data/patents/code),3,search events across the research cycle,NA,"multidisciplinary search engine, for events in research whole cycle",E,NA,no account,NA,NA,V,NA,NA,NA,NA,NA
1274,Delpher,http://www.delpher.nl/,2013,search (lit/data/patents/code),3,search engine for full text search of Dutch literary and journalism heritage,NA,"multidisciplinary search engine, searching digitized historical documents",E,NA,https://twitter.com/DelpherNL,963,NA,V,NA,NA,NA,NA,NA
1612,Open Knowledge Maps,http://openknowledgemaps.org/,2016,search (lit/data/patents/code),3,discovery tool for open science through mapping/visualization (built on PLoS Library),NA,"multidisciplinary search engine, visual",E/O,NA,https://twitter.com/ok_maps,297,NA,NA,NA,NA,NA,NA,NA
1531,PLOS Cloud Explorer,http://groups.ischool.berkeley.edu/ploscloudexplorer/,2014,search (lit/data/patents/code),3,Visualization of PLOS articles by subject areas,NA,"multidisciplinary search engine, with visualization",E,NA,no account,NA,NA,V,NA,NA,NA,NA,NA
1190,OpenEdition,http://www.openedition.org/?lang=en,2011,search (lit/data/patents/code),3,"Platform that combines calendar, blogging and OA journals/books for (French) SSH",NA,OA journal platform,O,NA,https://twitter.com/openeditionsays,7371,NA,V,NA,NA,NA,NA,NA
1442,RockYourPaper,http://www.rockyourpaper.org/,2013,search (lit/data/patents/code),3,"(OA) Discovery and reference management platform focus on South Asia, Africa and Latin America",NA,open access search engine,O/E,NA,https://twitter.com/rockurpaper,155,NA,V,NA,NA,NA,NA,NA
1439,OpenAIRE,https://www.openaire.eu,2010,search (lit/data/patents/code),3,"knowledge infrastructure aggregating OA and funded (FP7, H2020, national) content",NA,open access search engine,O,NA,"https://twitter.com/OpenAIRE_eu
",6151,NA,V,NA,NA,NA,NA,NA
1040,OAIster,http://oaister.worldcat.org/,2002,search (lit/data/patents/code),3,scholarly search engine indexing repositories,NA,open access search engine,O,NA,no account,NA,NA,V,NA,NA,NA,NA,NA
1053,BASE (Bielefeld Academic Search Engine),http://www.base-search.net/,2004,search (lit/data/patents/code),3,scholarly search engine indexing repository content,NA,open access search engine,E/O,NA,https://twitter.com/BASEsearch,685,NA,V,NA,NA,NA,NA,NA
1188,CORE,https://core.ac.uk/,2011,search (lit/data/patents/code),3,search across OA repositories,NA,open access search engine,E/O,NA,no account,NA,NA,V,NA,NA,NA,NA,NA
1403,Digital Commons Network,http://network.bepress.com/,2004,search (lit/data/patents/code),3,search engine for content of repositories using BEpress software,NA,open access search engine,E,NA,no account,NA,"
",V,NA,NA,NA,NA,NA
1489,WonderLib,https://askwonder.com/,2015,search (lit/data/patents/code),3,"research engine fuelled by experts: email questions, expert researcher will send back key reseources",NA,Q&A platform,E,NA,https://twitter.com/wonderlib,34,NA,V,NA,NA,NA,NA,NA
1116,Stack Exchange,http://stackexchange.com/sites#,2008,search (lit/data/patents/code),3,"Scholarly and non scholarly Q&A, by subject",NA,Q&A platform,E,NA,https://twitter.com/StackExchange,17K,NA,V,NA,NA,NA,NA,NA
1222,Biostars,https://www.biostars.org/,2012,search (lit/data/patents/code),3,"Q&A platform for bioinformatics, by subject",NA,"Q&A platform, field-specific",E,NA,https://twitter.com/biostarquestion,998,NA,V,NA,NA,NA,NA,NA
1141,Wolfram Alpha,http://www.wolframalpha.com/,2009,search (lit/data/patents/code),3,computational knowledge engine,NA,reference,E,NA,https://twitter.com/Wolfram_Alpha,48.9K,NA,V,V,NA,NA,NA,NA
1338,ContentMine,http://contentmine.org/,2014,search (lit/data/patents/code),3,mine facts from scientific literature,NA,reference (as linked data),E,NA,https://twitter.com/TheContentMine,1462,NA,V,V?,NA,NA,NA,NA
