ID,NAME,URL,WEBLAUNCHYEAR,PRIMEPHASEALPHA,PRIMEPHASENUMBER,FUNCTIONFREE,UI_FUNCTIONFREE,FUNCTIONCONTROLLLED,G-E-O-CATEGORY,UI_GEOCATEGORY,TWITTERACCOUNT,TWITTERFOLLOW_LATEST,ACTIVEPRE,ACTIVEDIS,ACTIVEANA,ACTIVEWRI,ACTIVEPUB,ACTIVEOUT,ACTIVEASS
1321,GlobalEventList,http://www.globaleventslist.elsevier.com/,2013,present research findings,21,comprehensive directory of scientific events worldwide,NA,conference directory,E,NA,https://twitter.com/GlobalEventList,1331,NA,NA,NA,NA,NA,V,NA
1178,Lanyrd,http://lanyrd.com,2010,present research findings,21,social conference directory,NA,"conference directory, social",E,NA,https://twitter.com/lanyrd,11.3K,NA,NA,NA,NA,NA,V (conferences),NA
1597,Sciencesconf,http://www.sciencesconf.org/,2010,present research findings,21,platform for organizing conferences,NA,organize conferences/events,E,NA,no account,NA,NA,NA,NA,NA,NA,V,NA
1632,Virtually Connecting,http://virtuallyconnecting.org/,NA,present research findings,21,Virtual participation in academic conferences,NA,sharing confernce participation,E/O,NA,https://twitter.com/VConnecting,1040,NA,NA,NA,NA,NA,V,NA
1514,Omeka.net,https://www.omeka.net/,2010,present research findings,21,"webbased CMS for easy website building, targeting humanities",NA,website building platform,E,NA,https://twitter.com/omeka,4131,NA,NA,NA,NA,V,NA,NA
1666,Open Conference Systems,https://pkp.sfu.ca/ocs/,2000,present research findings,21,Conference website publishing tool,NA,organize conferences/events,E,NA,https://twitter.com/pkp,2139,NA,NA,NA,NA,NA,V,NA
1664,Sched,https://sched.org/,2008,present research findings,21,event planning,NA,organize conferences/events,E,NA,https://twitter.com/sched,7067,NA,NA,NA,NA,NA,V,NA
1665,ConfTool,http://www.conftool.net/en/index.html,2004,present research findings,21,facilitate conference organization,NA,organize conferences/events,E,NA,no account,NA,NA,NA,NA,NA,NA,V,NA
1646,LOD for conferences Springer,http://lod.springer.com/data/search,2015,present research findings,21,ID for conferences (in computer science),NA,"ID, for conferences",E,NA,no account,NA,NA,NA,NA,NA,NA,V,NA
1647,CEUR-WS,http://ceur-ws.org/,1995,present research findings,21,publishing platform for workshop proceedings (computer science),NA,"proceedings platform, field specific",E/O,NA,no account,NA,NA,NA,NA,NA,V,V,NA
1212,BMJ Open: Open peer review,http://bmjopen.bmj.com/,2011,peer review and commenting/recommending (pre-pub),22,open peer review,NA,innovative journal,G/O,NA,https://twitter.com/BMJ_Open,10K,NA,NA,NA,NA,V (peer review),NA,NA
1322,Axios Review,http://axiosreview.org/,2013,peer review and commenting/recommending (pre-pub),22,independent peer review service (commercial),NA,journal independent peer review,G,NA,https://twitter.com/axiosreview,570,NA,NA,NA,NA,V (peer review),NA,NA
1179,Peerage of Science,https://www.peerageofscience.org/,2010,peer review and commenting/recommending (pre-pub),22,journal independent peer review,NA,journal independent peer review,G,NA,https://twitter.com/peeragescience,904,NA,NA,NA,NA,V (peer review),NA,NA
1254,Rubriq,http://www.rubriq.com/,2012,peer review and commenting/recommending (pre-pub),22,journal independent peer review,NA,journal independent peer review,G,NA,https://twitter.com/RubriqNews,479,NA,NA,NA,NA,V (peer review),NA,V
1024,BMJ (British Medical Journal),http://www.bmj.com/theBMJ,1999,peer review and commenting/recommending (pre-pub),22,Journal with non-anonymous peer review,NA,non-anonymous peer review (pre-publication),O/G,NA,https://twitter.com/bmj_latest,235K,NA,NA,NA,NA,V (also peer review),NA,NA
1252,Haldane's Sieve,http://haldanessieve.org/,2012,peer review and commenting/recommending (pre-pub),22,blog discussing selected preprints in genetics,NA,"paper commenting, dicussing or rating",E/G,NA,https://twitter.com/Haldanessieve,2864,NA,NA,NA,NA,NA,NA,V
1107,Scirate,https://scirate.com,2007,peer review and commenting/recommending (pre-pub),22,rate and comment on ArXiV papers,NA,"paper commenting, dicussing or rating",G,NA,https://twitter.com/scirate3,135,NA,NA,NA,NA,NA,NA,V
1324,SelectedPapers,https://selectedpapers.net/,2013,peer review and commenting/recommending (pre-pub),22,"recommend, comment, discuss papers (in maths and astrophysics)",NA,"paper commenting, dicussing or rating",E/G,NA,no account,NA,NA,NA,NA,NA,NA,NA,V
1151,VoxCharta,http://harvard.voxcharta.org/,2009,peer review and commenting/recommending (pre-pub),22,voting & discussion on ArxiV papers for >200 institutions,NA,"paper commenting, dicussing or rating",G/E,NA,no account,NA,NA,NA,NA,NA,NA,NA,V
1371,PRE-val,http://pre-val.org/,2014,peer review and commenting/recommending (pre-pub),22,"peer review evaluation + badge (for publishers to buy into, for end-users to use)",NA,peer review evaluation,G,NA,https://twitter.com/adametkin,641,NA,NA,NA,NA,V (peer review),NA,V
1334,Publons,https://publons.com/,2013,peer review and commenting/recommending (pre-pub),22,crediting peer review activity,NA,peer review registration,G,NA,https://twitter.com/Publons,3553,NA,NA,NA,NA,V (peer review),NA,V
1629,ReviewerCredits,reviewercredits.com,2016,peer review and commenting/recommending (pre-pub),22,crediting peer review activity,NA,peer review registration,G,NA,https://twitter.com/reviewercredits,73,NA,NA,NA,NA,NA,NA,V
1579,ReviewerRecognition,https://www.reviewerrecognition.elsevier.com/,2014,peer review and commenting/recommending (pre-pub),22,Documenting peer review for Elsevier journals,NA,peer review registration,E,NA,no account,NA,NA,NA,NA,NA,V (peer review),NA,V
1580,ReviewerPage,https://www.reviewerpage.com/,2015,peer review and commenting/recommending (pre-pub),22,"Publicly crediting peer review for Elsevier reviewers, open for PR from all journals",NA,peer review registration,G,NA,no account,NA,NA,NA,NA,NA,V (peer review),NA,V
1323,Libre Liberating Research (dead?),http://lib-res.org/,2013,peer review and commenting/recommending (pre-pub),22,open peer review,NA,platform for open peer review,G/O,NA,https://twitter.com/libreapp,8,NA,NA,NA,NA,V (peer review),NA,NA
1370,Academic Karma,http://academickarma.org/,2014,peer review and commenting/recommending (pre-pub),22,"peer review platform, connecting authors, reviewers and editors",NA,platform for peer review,E,NA,https://twitter.com/AcademicKarma,1065,NA,NA,NA,NA,V (peer review),NA,NA
1253,Reproducability initiative (by ScienceExchange),http://validation.scienceexchange.com/#/reproducibility-initiative,2012,peer review and commenting/recommending (pre-pub),22,crowdsourced validation of experimental results,NA,reproducibility,G,NA,https://twitter.com/_refinery,32,NA,NA,V,NA,NA,NA,V
1648,SciPost,https://scipost.org,2016,peer review and commenting/recommending (pre-pub),22,"Publication platform/journal for physics from a.o. arXiv, with own open peer review functionality",NA,innovative journal,O/G,NA,https://twitter.com/scipost_dot_org,76,NA,NA,NA,NA,V,NA,V
1374,Scientific Journal Finder,http://www.sjfinder.com/,2014,select journal to submit to,23,journal recommender based on title and abstract of scientific manuscript in life sciences,NA,"find journal, matching your abstract/text",E,NA,https://twitter.com/SJFinder,33,NA,NA,NA,NA,V,NA,NA
1255,Edanz journal selector,https://www.edanzediting.com/journal-selector,2012,select journal to submit to,23,journal selecting for submitting,NA,"find journal, matching your abstract/text",E,NA,https://twitter.com/edanzediting,614,NA,NA,NA,NA,V,NA,NA
1108,Jane,http://www.biosemantics.org/jane/,2007,select journal to submit to,23,journal selection support with co-word analysis,NA,"find journal, matching your abstract/text",E,NA,no account,NA,NA,NA,NA,NA,V,NA,NA
1067,eTblast,http://etest.vbi.vt.edu/etblast3/,2004,select journal to submit to,23,search PubMed PMC ArXiv etc using text similarity,NA,"find journal, matching your abstract/text",E,NA,no account,NA,NA,V,NA,NA,V,NA,NA
1373,Journal Guide,https://www.journalguide.com/,2014,select journal to submit to,23,selection of journals to submit paper to,NA,"find journal, matching your abstract/text",E,NA,https://twitter.com/JournalGuide,427,NA,NA,NA,NA,V,NA,NA
1463,Cabell directories,http://www.cabells.com/index.aspx,1978,select journal to submit to,23,"Directory of journal parameters
",NA,"journal list, metrics, metadata",E,NA,no account,NA,NA,NA,NA,NA,V,NA,NA
1488,ROAD,http://road.issn.org/,2013,select journal to submit to,23,directory of OA scholarly resources (from ISSN registry),NA,"journal list, metrics, metadata",O,NA,https://twitter.com/ISSN_IC,339,NA,V,NA,NA,NA,NA,NA
1426,Enago journal information tool,http://www.enago.com/publication-support/201.htm,2013,select journal to submit to,23,get basic journal data and metrics,NA,"journal list, metrics, metadata",E,NA,suspended,NA,NA,NA,NA,NA,V,NA,(V)
1051,DOAJ (Directory of Open Access Journals),https://doaj.org/,2003,select journal to submit to,23,listing OA journals,NA,"journal list, metrics, metadata",O,NA,https://twitter.com/DOAJplus,6532,NA,V,NA,NA,V,NA,(V)
1089,Sherpa/ROMEO,http://www.sherpa.ac.uk/romeo/,2006,select journal to submit to,23,show publisher copyright policies & self-archiving rights,NA,"journal list, metrics, metadata",O,NA,https://twitter.com/SHERPAServices,1754,NA,NA,NA,NA,V,NA,NA
1372,CoFactorScience,http://cofactorscience.com/,2014,select journal to submit to,23,"consultancy: workshops, editing, journal selector",NA,journal recommendation,E,NA,https://twitter.com/cofactorsci,376,NA,NA,NA,NA,V,NA,NA
1552,ThinkCheckSubmit,http://thinkchecksubmit.org/,2015,select journal to submit to,23,Checklist with criteria to judge trustworthiness of journals,NA,journal review criteria,E,NA,https://twitter.com/thinkchecksub,811,NA,NA,NA,NA,V,NA,NA
1325,Scirev,https://scirev.sc/,2013,select journal to submit to,23,journal evaluation by authors,NA,journal reviews,E,NA,https://twitter.com/scirev,483,NA,NA,NA,NA,V,NA,(V)
1424,JournalReviewer,http://journalreviewer.org/,2013,select journal to submit to,23,journal evaluation by authors,NA,journal reviews,E,NA,no account,NA,NA,NA,NA,NA,V,NA,(V)
1425,Journalysis,http://www.journalysis.org/,2013,select journal to submit to,23,journal evaluation by authors,NA,journal reviews,E,NA,https://twitter.com/journalysis,496,NA,NA,NA,NA,V,NA,(V)
1462,SciForum Journal Reviews,http://sciforum.net/statistics,NA,select journal to submit to,23,platform for rating/reviewing journals (with journal statistics),NA,journal reviews,E/G,NA,https://twitter.com/sciforum,546,NA,NA,NA,NA,NA,NA,V
1256,QOAM,https://www.qoam.eu/,2012,select journal to submit to,23,reviewing OA journals,NA,journal reviews,E,NA,no account,NA,NA,NA,NA,NA,V,NA,(V)
1649,rchiveit,https://rchive.it/,2013,select journal to submit to,23,simple interface for SherpaRomeo (open source),NA,finding sharing rights,E/O,NA,no account,NA,NA,NA,NA,NA,V,NA,NA
1516,Open Edition Books,http://books.openedition.org/,2013,publish,24,"open digital monographs, part of Open Edition (FR)",NA,"book platform, partly Open Access",O,NA,https://twitter.com/oe_books,1208,NA,NA,NA,NA,V,NA,NA
1561,Discrete Analysis,https://gowers.wordpress.com/2015/09/10/discrete-analysis-an-arxiv-overlay-journal/,2015,publish,24,ArXiv overlay journal for mathematics,NA,innovative journal,E/O,NA,no account,NA,NA,NA,NA,NA,V,NA,NA
1518,Journal of Digital Humanities,http://journalofdigitalhumanities.org/,2011,publish,24,"comprehensive, peer-reviewed, open access journal that features the best scholarship, tools, and conversations produced by the digital humanities community in the previous trimester",NA,innovative journal,O/G,NA,https://twitter.com/JournalofDH,571,NA,NA,NA,NA,V,NA,NA
1464,Biodiversity Data Journal,biodiversitydatajournal.com,2013,publish,24,Data journal experimenting with community peer review [but check details - how novel is it?],NA,innovative journal,O,NA,https://twitter.com/BioDataJournal,628,NA,NA,NA,NA,V,NA,NA
1465,Scientific Data (Nature),http://www.nature.com/sdata/,2014,publish,24,data journal for papers describing datasets,NA,innovative journal,"O
",NA,https://twitter.com/ScientificData,14.4K,NA,NA,NA,NA,V,NA,NA
1517,DHNOW,digitalhumanitiesnow.org,2009,publish,24,"experimental, edited publication that highlights and distributes informally published digital humanities scholarship and resources from the open web",NA,innovative journal,O/G,NA,https://twitter.com/dhnow,24.6K,NA,NA,NA,NA,V,NA,NA
1650,Wellcome Open Research,https://wellcomeopenresearch.org/,2016,publish,24,funder initiated journal,NA,innovative journal,O/E,NA,https://twitter.com/WellcomeOpenRes,424,NA,NA,NA,NA,V,NA,NA
1581,ReScience,https://rescience.github.io/,2015,publish,24,GitHub-based journal for replications of computational studies,NA,innovative journal,O/G,NA,https://twitter.com/ReScienceEds,374,NA,NA,NA,NA,V,NA,NA
1469,Self Journal of Science,http://sjscience.org/,2015,publish,24,"independent journal/publishing platform, aiming to ""to achieve optimal peer review, evaluation and classification of articles in a virtuously self-organized way""",NA,innovative journal,O,E,https://twitter.com/social_sjs,110,NA,NA,NA,NA,V,NA,"V
"
1551,Rio (Research ideas & Outcomes) Journal,http://riojournal.com/,2015,publish,24,integrated authoring / publishing / reviewing platform,NA,innovative journal,O/G,NA,https://twitter.com/RIOJournal,1116,NA,NA,NA,NA,V,NA,V
1553,Research Involvement and Engagement,http://researchinvolvement.biomedcentral.com/,2015,publish,24,"interdisciplinary health and social care journal co-produced by all key stakeholders, including patients, academics, policy makers and service users",NA,innovative journal,G,NA,no account,NA,NA,NA,NA,NA,V,NA,NA
1153,IPOL journal,http://www.ipol.im/,2009,publish,24,Journal for image processing,NA,innovative journal,E,NA,https://twitter.com/IPOL_journal,143,NA,NA,NA,NA,V,NA,NA
1535,Audiovisual thinking,http://www.audiovisualthinking.org/,2010,publish,24,Journal for videos on audiovisual culture,NA,innovative journal,"O/E
",NA,no account,NA,NA,NA,NA,NA,V,NA,NA
1127,ZooKeys journal,http://www.pensoft.net/page.php?P=14,2008,publish,24,journal publishing,NA,innovative journal,E,NA,https://twitter.com/ZooKeys_Journal,2455,NA,NA,NA,NA,V,V,NA
1376,ScienceOpen Research,https://www.scienceopen.com/collection/scienceopen_research,2014,publish,24,OA journal,NA,innovative journal,O,NA,https://twitter.com/SO_Research,922,NA,V,NA,V,V (also peer review),NA,V
1393,Collabra,http://www.collabra.org/,2015,publish,24,OA journal,NA,innovative journal,E/O,NA,https://twitter.com/CollabraOA,1287,NA,NA,NA,NA,V,NA,(V)
1213,GigaScience journal,http://www.gigasciencejournal.com/,2011,publish,24,OA journal for big-data studies,NA,innovative journal,O,NA,https://twitter.com/GigaScience,5854,NA,(V),NA,NA,V,NA,NA
1257,eLife,http://elifesciences.org/,2012,publish,24,"OA megajournal, reader (eLife Lens), discovery (Lens Browser), also available as publishing software on GitHub",NA,innovative journal,O,NA,https://twitter.com/elife,21.8K,NA,V,NA,NA,V,NA,NA
1258,F1000Research,http://f1000research.com/,2012,publish,24,Open access journal,NA,innovative journal,O,NA,https://twitter.com/F1000Research,15.3K,NA,NA,NA,NA,V,NA,V
1259,PeerJ,https://peerj.com,2012,publish,24,Open Access journal,NA,innovative journal,O,NA,https://twitter.com/thePeerJ,14.6K,NA,NA,NA,NA,V,NA,NA
1090,PLoS One,www.plosone.org,2006,publish,24,open access megajournal,NA,innovative journal,E,NA,https://twitter.com/PLOSONE,78.6K,NA,NA,NA,NA,V,NA,V
1375,Open Library of Humanities,https://www.openlibhums.org/,2014,publish,24,open access megajournal for SSH,NA,innovative journal,O,NA,https://twitter.com/openlibhums,6921,NA,NA,NA,NA,V,NA,NA
1583,Matters,https://sciencematters.io/,2015,publish,24,publish single observations & extend the subsequent observations in real-time,NA,innovative journal,E/O,NA,https://twitter.com/SciMts,2317,NA,NA,NA,NA,V,NA,NA
1031,BMC (BiomedCentral),http://www.biomedcentral.com/,2000,publish,24,Gold OA publishing,NA,innovative journal platform/publisher,O,NA,https://twitter.com/BioMedCentral,43.1K,NA,NA,NA,NA,V,NA,NA
1582,LingOA,http://www.lingoa.eu/,2015,publish,24,OA Publishing platform for linguistics,NA,innovative journal platform/publisher,O,NA,no account,NA,NA,NA,NA,NA,V,NA,NA
1018,SciELO (Scientific Electronic Library Online),http://www.scielo.org,1998,publish,24,Open Access journal platform for Latin America and Iberia,NA,innovative journal platform/publisher,O,NA,https://twitter.com/redescielo,36.2K,NA,V,NA,NA,V,NA,NA
1614,PubPub,http://www.pubpub.org/,2016,publish,24,"open platform for creating, distributing, and reviewing publications.",NA,innovative journal platform/publisher,O/G,NA,https://twitter.com/pubpub,385,NA,NA,NA,NA,V,NA,NA
1109,WebMed Central,http://www.webmedcentral.com,2007,publish,24,Open Access biomedical publisher using post-publication peer review,NA,innovative publisher,O/G,NA,https://twitter.com/WebmedCentral,1281,NA,NA,NA,NA,V,NA,(V)
1556,Archivist,https://medium.com/@_daniel/publish-interactive-historical-documents-with-archivist-7019f6408ee6,2015,publish,24,platform for publishing interactive interview transcriptions online,NA,innovative specialized publishing platform,E,NA,no account,NA,NA,NA,NA,NA,V,NA,NA
1466,Biotaxa,http://biotaxa.org/,2012,publish,24,Online publishing platform for taxonomic journals,NA,journal platform,"E/O
",NA,https://twitter.com/BiotaxaNews,241,NA,NA,NA,NA,V,NA,NA
1515,Revues.org,http://www.revues.org/,1999,publish,24,"platform for open journals, part of Open Edition (FR)",NA,"journal platform, Open Access",O,NA,https://twitter.com/revuesorg,5452,NA,NA,NA,NA,V,NA,NA
1045,Creative Commons,http://creativecommons.org/,2002,publish,24,licensing&copyright for internet era,NA,licensing,O,NA,https://twitter.com/creativecommons,604K,NA,V?,NA,NA,V,NA,NA
1032,DOI (Digital Object Identifier),http://www.doi.org/,2000,publish,24,permalink and disambiguation of publications,NA,persistant identifiers,E,NA,no account,NA,NA,V,NA,NA,V,V,NA
1152,Datacite,https://www.datacite.org/,2009,publish,24,develop standards for persistent identifiers for data,NA,"persistant identifiers, standards",E,NA,https://twitter.com/datacite,5288,NA,V,NA,NA,V,NA,NA
1468,ProcPoS,https://www.peerageofscience.org/proceedings,2014,publish,24,Proceedings of Peerage of Science: peer-reviewed commentary journal,NA,platform for PPPR,O,NA,https://twitter.com/ProcPoS,74,NA,NA,NA,NA,V,NA,"V
"
1441,PressForward,http://pressforward.org/,2011,publish,24,Wordpress plugin for OA content aggregation and distribution/republication,NA,republishing,O/E,NA,"https://twitter.com/pressfwd
",1149,NA,NA,NA,NA,V,V,NA
1467,PaperNow,https://github.com/PeerJ/paper-now,2015,publish,24,"Create, edit and display a journal article in GitHub",NA,"journal article platform, virtual",O,NA,no account,NA,NA,NA,NA,V,V,NA,NA
1651,dokieli,https://dokie.li/,2016,publish,24,"clientside editor for decentralised article publishing, annotations and social interactions","Allows article authoring from the Web browser. Inline annotations can be created by anyone using their choice of CC license. Inline citations can be created (eg fragment of text in the current article can cite (with a specific semantics) another fragment of text in another article elsewhere on the Web. Notifications are sent for various interactions (sharing, annotations, citations). Flexibility to ""save as"" anyhwere on the Web with available credentials.","innovative journal/publishing, annotations, notifications",O,NA,no account,NA,NA,V,NA,V,V,V,V
1667,DHcommons journal,http://dhcommons.org/journal,2015,publish,24,digital humanities journal for reviewing ongoing projects,NA,innovative journal,O,NA,no account,NA,NA,NA,NA,NA,V,NA,V
1668,OJS (Open Journal Systems),https://pkp.sfu.ca/ojs/,2001,publish,24,Editorial services for publishers,NA,journal platform,E,NA,no account,NA,NA,NA,NA,NA,V,NA,NA
1034,Wikipedia (& Wikimedia Commons),https://www.wikipedia.org/,2001,outreach/valorization,25,collaborative online general reference tool,NA,adding to broad popular resource,O,NA,https://twitter.com/Wikipedia,353K,NA,V,NA,NA,NA,V,NA
1129,Hypotheses,http://hypotheses.org/,2008,outreach/valorization,25,"Academic blogging platform, part of Open Edition",NA,blogging network,O,NA,https://twitter.com/hypothesesorg,6646,NA,NA,NA,NA,NA,V,NA
1470,SciLogs,http://www.scilogs.com/,2011,outreach/valorization,25,"Group of science blogs
",NA,blogging network,E,NA,https://twitter.com/scilogscom,4741,NA,NA,NA,NA,NA,V,NA
1091,iddidd,http://scienceblogs.com/,2006,outreach/valorization,25,science blogging network,NA,blogging network,O,NA,https://twitter.com/scienceblogs,12.1K,NA,NA,NA,NA,NA,V,NA
1180,Scientopia,http://scientopia.org/,2010,outreach/valorization,25,science blogging network,NA,blogging network,O,NA,https://twitter.com/ScientopiaBlogs,3841,NA,NA,NA,NA,NA,V,NA
1584,ExternalDiffusion,http://www.externaldiffusion.com/,2015,outreach/valorization,25,science blogging platform,NA,blogging network,O,NA,https://twitter.com/Ext_diffusion,6263,NA,NA,NA,NA,NA,V,NA
1438,Scienceseeker,http://www.scienceseeker.org/,2011,outreach/valorization,25,Aggregator of science news and blogs,NA,blogging network & news,E,NA,https://twitter.com/SciSeeker,2880,NA,V,NA,NA,NA,V,NA
1519,ECAST,"http://www.ecastnetwork.org/
",2010,outreach/valorization,25,Expert & Citizen Assessment of Science & Technology - A Distributed Network of Institutions for Peer to Peer Public Deliberation,NA,citizen assessment,G,NA,https://twitter.com/ECASTnetwork,30,NA,NA,NA,NA,NA,V,V
1559,Frontiers for Young Minds,http://kids.frontiersin.org/,2013,outreach/valorization,25,web-based scientific journal with an editorial board of children (8-15yr),NA,"citizen review, by children",O,NA,https://twitter.com/FrontYoungMinds,2199,NA,NA,NA,NA,NA,V,NA
1047,Sense about Science,http://www.senseaboutscience.org/,2002,outreach/valorization,25,activities and publications to change public discussions about science and evidence,NA,debating/discussing,G,NA,https://twitter.com/senseaboutsci,36.7K,NA,NA,NA,NA,NA,V,NA
1260,Pint of Science,http://pintofscience.co.uk/,2012,outreach/valorization,25,Discussing science in a local pub,NA,debating/discussing,O,NA,https://twitter.com/pintofscience,12.4K,NA,NA,NA,NA,NA,V,NA
1068,Voice of Young Science (part of Sense about Science),http://www.senseaboutscience.org/pages/voys.html,2004,outreach/valorization,25,encourages early career researchers to play an active role in public debates about science,NA,debating/discussing,G,NA,https://twitter.com/voiceofyoungsci,4583,NA,NA,NA,NA,NA,V,NA
1431,Open Science Showoff,http://www.scienceshowoff.org/,2011,outreach/valorization,25,Open mic night for science lovers,NA,debating/discussing,E,NA,https://twitter.com/ScienceShowoff,8236,NA,NA,NA,NA,NA,V,NA
1130,I Am Scientist,http://imascientist.ie/,2008,outreach/valorization,25,outreach to students through chat contest,NA,debating/discussing,O,NA,https://twitter.com/imascientist,14.1K,NA,NA,NA,NA,NA,V,NA
1537,redditscience AMA (a.o. PLOS Science Wednesday),https://www.reddit.com/r/science/,2012,outreach/valorization,25,Discuss your science with broader community,NA,discussion,O,NA,https://twitter.com/RedditScience,2306,NA,NA,NA,NA,NA,V,NA
1394,Fact Check Central,http://factcheckcentral.org/,2015,outreach/valorization,25,aggregated list of blogs from a selection of fact checking organisations,NA,fact-checking,O,NA,no account,NA,NA,NA,NA,NA,NA,V,NA
1395,SciCheck,http://www.factcheck.org/scicheck/,2015,outreach/valorization,25,fact checking scientific claims made by US politicians to influence public policy,NA,fact-checking,O,NA,no account,NA,NA,NA,NA,NA,NA,V,NA
1430,AskforEvidence,http://askforevidence.org/index,2014,outreach/valorization,25,"Tool to ask for evidence, or to share experience asking for evidence NB this is part of Sense About Science (ID1047)",NA,fact-checking,E/G,NA,https://twitter.com/senseaboutsci,36.7K,NA,NA,NA,NA,NA,V,(V)
1377,Draw Science,http://blog.drawscience.org/,NA,outreach/valorization,25,NA,NA,innovative journal,NA,NA,NA,NA,NA,NA,NA,NA,NA,V,NA
1214,Limn,limn.it,2011,outreach/valorization,25,free journal for communicating exciting research in the social and human sciences,NA,innovative journal,O,NA,https://twitter.com/LimnMagazine,600,NA,NA,NA,NA,V,V,NA
1545,JSTOR daily,http://daily.jstor.org/,2014,outreach/valorization,25,"linking news stories to scholarly research, with free access to JSTOR articles",NA,innovative journal,O/G,NA,https://twitter.com/JSTOR_Daily,14.8K,NA,NA,NA,NA,NA,V,NA
1521,United Academics,http://www.united-academics.org/,2009,outreach/valorization,25,"Magazine to bring science to the public; OA publisher; database of OA research papers, dissertations and theses; community",NA,innovative journal,O,NA,https://twitter.com/United_Science,1434,NA,V,NA,NA,V,V,NA
1427,Research Blogging,researchblogging.org,2008,outreach/valorization,25,collection/curation of blog posts about peer-reviewed research,NA,innovative journal platform/publisher,E,NA,https://twitter.com/ResearchBlogs,8858,NA,NA,NA,NA,NA,V,(V)
1378,Elsevier Atlas,https://www.elsevier.com/atlas,2014,outreach/valorization,25,Republishing some selected high impact articles in lay-friendly format and OA,NA,"innovative journal, overlay",O,NA,https://twitter.com/ElsevierAtlas,714,NA,NA,NA,NA,NA,V,NA
1215,SocialScienceSpace,http://www.socialsciencespace.com/,2011,outreach/valorization,25,connect SS researchers and promote SS,NA,online community,O,NA,https://twitter.com/socscispace,9157,NA,NA,NA,NA,NA,V,NA
1046,HASTAC,https://www.hastac.org/,2002,outreach/valorization,25,"online community and social network for (mainly) DH, geared towards education/teaching",NA,online community,O,NA,https://twitter.com/HASTAC,15.1K,NA,NA,NA,NA,NA,V,NA
1326,Kudos (pubs claimen en promoten),https://www.growkudos.com/,2013,outreach/valorization,25,"helps researchers explain, enrich and share their publications to increase research impact",NA,online promotion/linking of publications,O/E,NA,https://twitter.com/GrowKudos,2117,NA,NA,NA,NA,NA,V,V
