ID,NAME,URL,WEBLAUNCHYEAR,PRIMEPHASEALPHA,PRIMEPHASENUMBER,FUNCTIONFREE,UI_FUNCTIONFREE,FUNCTIONCONTROLLLED,G-E-O-CATEGORY,UI_GEOCATEGORY,TWITTERACCOUNT,TWITTERFOLLOW_LATEST,ACTIVEPRE,ACTIVEDIS,ACTIVEANA,ACTIVEWRI,ACTIVEPUB,ACTIVEOUT,ACTIVEASS
1567,Orgref,http://www.orgref.org/web/download.htm,2014,search (lit/data/patents/code),3,research organization directory/dataset with IDs (in CSV),NA,research organization directory,E/O,NA,https://twitter.com/OrgRef,542,V?,NA,NA,NA,V?,NA,V?
1566,GRID,https://www.grid.ac/,2015,search (lit/data/patents/code),3,research organization directory/dataset with IDs (in JSON/CSV),NA,research organization directory,E,NA,https://twitter.com/grid_ac,340,V?,NA,NA,NA,V?,NA,V?
1404,ACI Scholarly Blog Index,http://scholar.aci.info/,2014,search (lit/data/patents/code),3,"search engine for scholarly blogposts, with LCSH",NA,"scholarly blog posts search engine
",E,NA,https://twitter.com/aciblogindex,358,NA,V,NA,NA,NA,NA,NA
1094,mloss,http://mloss.org/,2007,search (lit/data/patents/code),3,Machine learning open source software - crowdsourced collection w/ focus on interoperability,NA,"search engine, field specific, for software",O/E,NA,no account,NA,NA,NA,V,NA,NA,NA,NA
1273,CrossRef Metadata Search,http://search.crossref.org/,2013,search (lit/data/patents/code),3,search DOI metadata,NA,"search engine, for metadata",E,NA,no account,NA,NA,V,NA,NA,NA,NA,NA
1615,Prepubmed,http://www.prepubmed.org/,2016,search (lit/data/patents/code),3,"search life science ""preprints"": indexes arXiv q-bio, PeerJ Preprints, Figshare, bioRxiv, and F1000Research",NA,"search engine, for preprints",E/O,NA,no account,NA,NA,V,NA,NA,NA,NA,NA
1446,FAIRsharing (prev. Biosharing),https://biosharing.org/,2009,search (lit/data/patents/code),3,"Portal for standards, databases and policies in the life sciences",NA,"search engine, for standards and databases",E,NA,https://twitter.com/biosharing,461,NA,V,NA,NA,NA,NA,NA
1115,ScienceStage,http://sciencestage.com/,2008,search (lit/data/patents/code),3,"Platform for science videos/podcasts, networking and outreach",NA,"search engine, for video",E/O,NA,https://twitter.com/sciencestage,2117,NA,NA,NA,NA,NA,V,NA
1192,Zanran,http://www.zanran.com,2011,search (lit/data/patents/code),3,search tables in texts on the web,NA,"search engine, for web tables",E,NA,https://twitter.com/ZanranSearch,140,NA,V,NA,NA,NA,NA,NA
1391,Memento Timetravel service,http://timetravel.mementoweb.org/,2015,search (lit/data/patents/code),3,metasearch for previous versions of webpages suing 10+ webpage archives,NA,"search engine, historical",E,NA,no account,NA,NA,V,NA,NA,NA,NA,NA
1037,Aquabrowser,http://www.proquest.com/products-services/AquaBrowser.html,2002,search (lit/data/patents/code),3,discovery layer over library catalogue,NA,search interface enhancement,E,NA,https://twitter.com/aquabrowser,308,NA,V,NA,NA,NA,NA,NA
1339,EvidenceFinder,http://labs.europepmc.org/evf,2014,search (lit/data/patents/code),3,enriches literature exploration in Europe PMC by suggesting questions (based on full-text results) alongside search results,NA,search interface enhancement,E,NA,no account,NA,NA,V,NA,NA,NA,NA,NA
1398,Arrowsmith,http://arrowsmith.psych.uic.edu/cgi-bin/arrowsmith_uic/start.cgi,2001,search (lit/data/patents/code),3,identifying meaningful links between two sets of PubMed literature,NA,search interface enhancement,E,NA,no account,NA,NA,V,NA,NA,NA,NA,NA
1224,Wikidata,http://www.wikidata.org,2012,search (lit/data/patents/code),3,Storage of structured data for wikimedia products,NA,search/use data,E,NA,https://twitter.com/wikidata,8200,NA,V,NA,NA,NA,NA,NA
1113,Primo,http://www.exlibrisgroup.com/category/PrimoOverview,2008,search (lit/data/patents/code),3,web scale discovery service,NA,web scale discovery search engine,E,NA,no account,NA,NA,V,NA,NA,NA,NA,NA
1140,Summon,http://www.proquest.com/products-services/The-Summon-Service.html,2009,search (lit/data/patents/code),3,web scale discovery service,NA,web scale discovery search engine,E,NA,no account,NA,NA,V,NA,NA,NA,NA,NA
1095,Worldcat Local,http://www.oclc.org/worldcat-local.en.html,2007,search (lit/data/patents/code),3,webscale configurable discovery service for libraries,NA,web scale discovery search engine,E,NA,no account,NA,NA,V,NA,NA,NA,NA,NA
1077,Worldcat Discovery,https://www.worldcat.org/,2006,search (lit/data/patents/code),3,webscale discovery of library holdings,NA,web scale discovery search engine,E,NA,no account,NA,NA,V,NA,NA,NA,NA,NA
1161,EDS (Ebsco Discovery Service),https://www.ebscohost.com/discovery,2010,search (lit/data/patents/code),3,webscale discovery search engine,NA,web scale discovery search engine,E,NA,no account,NA,NA,V,NA,NA,NA,NA,NA
1635,OSF preprint search,https://osf.io/preprints/discover,2016,search (lit/data/patents/code),3,aggregated preprint search engine,NA,"search engine, for preprints",O/E,NA,no account,NA,NA,V,NA,NA,NA,NA,NA
1657,La Referencia,http://www.lareferencia.info/,2013,search (lit/data/patents/code),3,federated network of institutional repositories in Latin America.,NA,"multidisciplinary search engine, for repository content",O/E,NA,https://twitter.com/RepositoriosLA,751,NA,V,NA,NA,V,NA,NA
1654,RES,https://bbcarchdev.github.io/res/,2014,search (lit/data/patents/code),3,"open discovery platform for digital collections of (UK) libraries, museums, broadcasters and galleries",NA,"multidisciplinary search engine, for digital collections",E/O,NA,https://twitter.com/RES_project,1379,NA,V,NA,NA,NA,NA,NA
1655,Open Citation Corpus,http://opencitations.net/,2010,search (lit/data/patents/code),3,repository for open scholarly citation data,NA,citation data corpus,O,NA,https://twitter.com/opencitations,336,NA,V,NA,NA,NA,NA,V
1656,Meta (was Sciencescape),https://meta.science,2015,search (lit/data/patents/code),3,scientific knowledge network powered by AI,NA,multidisciplinary search engine,E,NA,https://twitter.com/meta,4884,NA,V,NA,NA,NA,NA,NA
1658,JURN,http://www.jurn.org/,2009,search (lit/data/patents/code),3,"search open access journal articles, books and theses (Google custom search over curated index)",NA,open access search engine,O/E,NA,no account,NA,NA,V,NA,NA,NA,NA,NA
1275,Paperscape,http://paperscape.org/,2013,search (lit/data/patents/code),3,Visualisation built on  ArXiV,NA,field specific search engine,E,NA,no account,NA,NA,V,NA,NA,NA,NA,NA
1405,HowOpenIsIt? Open article gauge,http://oag.cottagelabs.com/,2013,get access,4,determine license for journal articles,NA,determine license,E,NA,no account,NA,NA,V,NA,NA,NA,NA,NA
1345,Scoap3,scoap3.org,2014,get access,4,collaboratively flipping journals to OA,NA,get access by promoting OA,O,NA,no account,NA,NA,V,NA,NA,V,NA,NA
1193,Unglue it,https://unglue.it/,2011,get access,4,crowdfunding to make specific books freely available with CC-license,NA,get access by promoting OA,O,NA,https://twitter.com/unglueit,1158,NA,NA,NA,NA,V,V,NA
1279,Open Access Button,https://www.openaccessbutton.org/,2013,get access,4,"raises awareness about (lack of) Open Access; offers alternative ways to get paywalled paper (repositories, contact author)",NA,get access by promoting OA,O,NA,https://twitter.com/OA_Button,7097,NA,V,NA,NA,NA,NA,NA
1117,Deepdyve,https://www.deepdyve.com/,2008,get access,4,Pay-per-view access to scholarly publications,NA,publication vendor,E,NA,https://twitter.com/deepdyve,1351,NA,V,NA,NA,NA,NA,NA
1041,Hinari,http://extranet.who.int/hinari/en/journals.php,2002,get access,4,reduced price access program,NA,reduced publication price / waivers,O,NA,https://twitter.com/R4LPartnership,1757,NA,V,NA,NA,NA,NA,NA
1162,"Research4life (in 4 UN programmes HINARI, AGORA, AORE, ARDI)",http://www.research4life.org,2010,get access,4,reduced priced access program,NA,reduced publication price / waivers,O,NA,https://twitter.com/R4LPartnership,1757,NA,V,NA,NA,V,NA,NA
1637,oadoi.org,https://oadoi.org,2016,get access,4,detect open access vesions of articles based on doi,NA,NA,O,NA,https://twitter.com/oaDOI_org,542,NA,V,NA,NA,NA,NA,NA
1659,DOAI,http://doai.io/,2016,get access,4,doi resolver pointing to Open Access versions (including on ResearchGate),NA,NA,O,NA,https://twitter.com/doai_io,40,NA,V,NA,NA,NA,NA,NA
1622,SciFeeds,https://scifeeds.com/,2015,get alerts/recommendations,5,"science aggregator using data from citation analysis, social media, news media, user interactions, and natural language processing",NA,aggregator showing recent and popular science information,E,NA,https://twitter.com/scifeeds,11.8K,NA,V,NA,NA,NA,NA,NA
1619,PubNiche,http://www.pubniche.com,2015,get alerts/recommendations,5,science news curation,NA,aggregator showing recent article abstracts,E,NA,https://twitter.com/PubNiche,3893,NA,V,NA,NA,NA,NA,NA
1284,Sparrho,http://www.sparrho.com/,2013,get alerts/recommendations,5,TOC/content alerting in feed format,NA,alert for resources based on TOCs or search terms,E,NA,https://twitter.com/sparrho,1676,NA,V,NA,NA,NA,NA,NA
1283,Scizzle,http://www.myscizzle.com/,2013,get alerts/recommendations,5,alerting tool built on PubMed,NA,"alert for resources based on TOCs or search terms, field specific",E,NA,https://twitter.com/myScizzle,800,NA,V,NA,NA,NA,NA,NA
1281,Nowomics,https://nowomics.com/,2013,get alerts/recommendations,5,news feed for biological data and publications,NA,"alert for resources based on TOCs or search terms, field specific",E,NA,https://twitter.com/nowomics,364,NA,V,NA,NA,NA,NA,NA
1280,Flypapers,https://twitter.com/fly_papers,2013,get alerts/recommendations,5,"Twitterbot of Drosophila papers in PubMed, ArXiV, BioRxiv, PeerJ and F1000",NA,"alert for resources based on TOCs or search terms, field specific",E,NA,https://twitter.com/fly_papers,1653,NA,V,NA,NA,NA,NA,NA
1282,PubChase,https://www.pubchase.com/,2013,get alerts/recommendations,5,alerting & recommendations; personal library sharing,NA,"alert for resources based on TOCs or search terms, field specific, also collaborative",E,NA,https://twitter.com/PubChase,548,NA,V,NA,NA,NA,NA,NA
1118,JournalTocs (previously TicTocs),http://www.journaltocs.hw.ac.uk/,2008,get alerts/recommendations,5,TOC-alerting,NA,"alert for resources based on TOCs or search terms, multifield",E,NA,https://twitter.com/journaltocs,1435,NA,V,NA,NA,NA,NA,NA
1194,Browzine,https://browzine.com/,2011,get alerts/recommendations,5,TOC/content alerting and PDF-reader,NA,"alert for resources based on TOCs or search terms, multifield",E,NA,https://twitter.com/browzine,110,NA,NA,NA,NA,NA,NA,NA
1226,TiNYARM ('This is not yet another reference manager'),http://atinyarm.appspot.com,2012,get alerts/recommendations,5,"share and suggest reading activities with peers, so that these can act as an information filter",NA,give and get recommendations,E,NA,no account,NA,NA,V,NA,NA,NA,NA,NA
1042,F1000 (Biology),http://f1000.com/prime,2002,get alerts/recommendations,5,recommendations,NA,recommendation by experts,E,NA,no account,NA,NA,V,NA,NA,NA,NA,V
1163,F1000 Prime,http://f1000.com/prime,2010,get alerts/recommendations,5,recommendations,NA,recommendation by experts,E,NA,https://twitter.com/F1000Prime,21.6K,NA,V,NA,NA,NA,NA,V
1660,CitePeer,http://citepeer.io,2016,get alerts/recommendations,5,"suggestions for closely related papers, based on semantic mapping against existing references of a paper. PubMed only.",NA,"alert for resources based on TOCs or search terms, field specific",E,NA,no account,NA,NA,V,NA,NA,NA,NA,NA
1285,CERMINE,http://cermine.ceon.pl/index.html,2013,reference management,6,extract metadata from scholarly PDF's,NA,extract metadata from publications,E,NA,no account,NA,NA,V,NA,NA,NA,NA,NA
1011,QUOSA,https://www.elsevier.com/solutions/quosa-scientific-literature,1996,reference management,6,enterprise reference management & full text management,NA,full text management for groups,E,NA,https://twitter.com/QUOSA1,62,NA,V,NA,NA,NA,NA,NA
1544,RefBank,http://refbank.refindit.org/RefBank/search,2012,reference management,6,"collaborative bibliography of biodiversity literature; nodes for different organizations, publishers (like Pensoft)",NA,reference management,O/E,NA,no account,NA,NA,V,NA,V,NA,NA,NA
1346,ACS ChemWorx,https://hp.acschemworx.acs.org/,2014,reference management,6,collaborative reference manager coupled with tools and services for authors,NA,reference management,E,NA,https://twitter.com/ACS4Authors,986,NA,V,NA,V,NA,NA,NA
1348,RefME,https://www.refme.com/,2014,reference management,6,"online reference manager;  search by book/journal article title, DOI, ISBN, ISSN or copy/paste URL, scan book bar code",NA,reference management,E,NA,https://twitter.com/GetRefME,14.7K,NA,V,NA,V,NA,NA,NA
1406,Stackly (disc. from 20150901),https://www.stackly.org,2014,reference management,6,"reference management tool, with shared 'stacks'to track",NA,reference management,E/O,NA,https://twitter.com/stacklysupport,7,NA,V,NA,NA,NA,NA,NA
1195,Bibliogo,http://info.bibliogo.com/,2011,reference management,6,reference management; alerts and PDF workflow,NA,reference management,E,NA,https://twitter.com/bibliogodev,NA,NA,V,NA,V,NA,NA,NA
1286,Google Scholar Library,http://scholar.google.com/scholar?scilib=1,2013,reference management,6,"simple reference management, restricted to GS records",NA,reference management,E,NA,no account,NA,NA,V,NA,V?,NA,NA,NA
1228,PaperPile,https://paperpile.com/,2012,reference management,6,web-based reference management tool,NA,reference management,E,NA,https://twitter.com/paperpile,2394,NA,V,NA,V,NA,NA,NA
1078,CiteUlike,http://www.citeulike.org/,2006,reference management,6,reference management & sharing,NA,reference management & sharing,E/O,NA,https://twitter.com/citeulike,1297,NA,V,NA,V,NA,NA,NA
1072,BibSonomy,http://www.bibsonomy.org/,2005,reference management,6,Share bookmarks and lists of literature.,NA,reference management & sharing,E,NA,https://twitter.com/BibSonomyCrew,273,NA,V,NA,NA,NA,NA,NA
1549,PaperBox,http://www.paper-box.co/,2012,reference management,6,"cloud-based reference + pdf management system
",NA,"reference management, with cite/bibliography options",E,NA,https://twitter.com/peaya,87,NA,V,NA,V,NA,NA,NA
1164,Qiqqa,http://www.qiqqa.com/,2010,reference management,6,free reference manager,NA,"reference management, with cite/bibliography options",E,NA,no account,NA,NA,V,NA,V,NA,NA,NA
1097,Wizfolio,http://wizfolio.com/,2007,reference management,6,"online reference management tool, also for mp3, video, weblinks etc.",NA,"reference management, with cite/bibliography options",E,NA,https://twitter.com/wizfoliosupport,52,NA,V,NA,V,NA,NA,NA
1005,Reference Manager,http://refman.com/,1984,reference management,6,reference management,NA,"reference management, with cite/bibliography options",E,NA,no account,NA,NA,V,NA,V,NA,NA,NA
1007,EndNote,http://endnote.com/,1988,reference management,6,reference management,NA,"reference management, with cite/bibliography options",E,NA,https://twitter.com/EndNoteNews,4344,NA,V,NA,V,NA,NA,NA
1033,RefWorks,http://www.refworks.com/,2001,reference management,6,reference management,NA,"reference management, with cite/bibliography options",E,NA,https://twitter.com/RefWorks,4236,NA,V,NA,V,NA,NA,NA
1048,Citavi,https://www.citavi.com/,2003,reference management,6,reference management,NA,"reference management, with cite/bibliography options",E,NA,https://twitter.com/citavi,1768,NA,V,NA,V,NA,NA,NA
1079,Zotero,https://www.zotero.org/,2006,reference management,6,reference management,NA,"reference management, with cite/bibliography options",E/O,NA,https://twitter.com/zotero,13.9K,NA,V,NA,V,NA,NA,NA
1096,PapersApp (Mekentosj -),http://www.papersapp.com/,2007,reference management,6,reference management,NA,"reference management, with cite/bibliography options",E,NA,https://twitter.com/papersapp,5157,NA,V,NA,V,NA,NA,NA
1119,Mendeley,https://www.mendeley.com/,2008,reference management,6,reference management,NA,"reference management, with cite/bibliography options",E/O,NA,https://twitter.com/MendeleySupport,9902,NA,V,NA,V,NA,V,V
1227,Colwiz,https://www.colwiz.com/,2012,reference management,6,reference management,NA,"reference management, with cite/bibliography options",E,NA,https://twitter.com/colwiz,705,NA,V,NA,V,NA,NA,NA
1287,Proquest Flow,https://flow.proquest.com/,2013,reference management,6,reference management,NA,"reference management, with cite/bibliography options",E,NA,no account,NA,NA,V,NA,V,NA,NA,NA
1550,Cite This For Me,https://www.citethisforme.com/,2012,reference management,6,"Reference management tool, shared bibliographies 
",NA,"reference management, with cite/bibliography options",E,NA,https://twitter.com/CiteThisForMe,470,NA,V,NA,V,NA,NA,NA
1347,F1000 Workspace (formerly beta),http://f1000.com/work/,2014,reference management,6,"reference management, making/sharing annotations in papers, commenting on references",NA,"reference management, with cite/bibliography options",E,NA,https://twitter.com/F1000,297,NA,V,NA,V,NA,(V),NA
1196,Docear,http://www.docear.org/,2011,reference management,6,"reference manager, writing platform, w/ mindmapping feature, literature suggestions based on mindmaps",NA,"reference management, with cite/bibliography options",E,NA,https://twitter.com/Docear_org,1260,NA,V,NA,V,NA,NA,NA
1638,Qiqqa (from crowdsourced list),http://www.qiqqa.com/,2010,reference management,6,"reference management, with suggestions, related documents, etc.",NA,"reference management, with cite/bibliography options",E,NA,https://twitter.com/Qiqqa,848,NA,V,NA,V,NA,NA,NA
1098,JCB dataviewer,http://jcb-dataviewer.rupress.org/,2007,read/view,7,viewing multidimensional images from JCB journal,NA,image viewer,E,NA,no account,NA,NA,V,NA,NA,NA,NA,NA
1230,Utopiadocs,http://utopiadocs.com/,2012,read/view,7,PDF reader esp. for scholarly docs suggesting related literature based on what you read,NA,PDF reader with extra options,E,NA,https://twitter.com/utopiadocs,491,NA,V,NA,NA,NA,NA,NA
1198,Readcube,https://www.readcube.com/,2011,read/view,7,"recommendations, PDF-reader, annotator, reference management",NA,PDF reader with extra options,E,NA,https://twitter.com/readcube,2916,NA,V,NA,(V),NA,NA,NA
1229,PubReader,http://www.ncbi.nlm.nih.gov/pmc/about/pubreader/,2012,read/view,7,alternative web presentation to read literature in PMC and Bookshelf (code in GitHub),NA,reading enhancement,E,NA,no account,NA,NA,V,NA,NA,NA,NA,NA
1555,Ferret,http://ferret.ai/,2015,read/view,7,Chrome extension for life sciences summarizing/enriching articles and providing full-text search based on reading history.,NA,reading enhancement,E,NA,https://twitter.com/getferret,236,NA,V,NA,NA,NA,NA,NA
1231,Wiley Smart Article,http://onlinelibrary.wiley.com/subject/code/000128/homepage/new.htm,2012,read/view,7,Enhanced article tools for chemistry content in Wiley journals,NA,reading enhancement,E,NA,no account,NA,NA,V,NA,NA,NA,NA,NA
1349,Wiley Anywhere Article,http://olabout.wiley.com/WileyCDA/Section/id-819787.html,2014,read/view,7,Enhanced HTML article from Wiley publisher.,NA,reading enhancement,E,NA,no account,NA,NA,V,NA,NA,NA,NA,NA
1197,Incontext,https://code.google.com/archive/p/surf-incontext/,2011,read/view,7,navigate through RDF relations in a smooth and understandable way,NA,reading enhancement,E,NA,no account,NA,NA,V,NA,NA,NA,NA,NA
1288,CrossMark,http://www.crossref.org/crossmark/,2013,read/view,7,show information on the version and updates of a publication,NA,reading enhancement,E/G,NA,https://twitter.com/CrossRefOrg,6454,NA,V,NA,NA,NA,NA,NA
1449,Annotag Calculator,"
",2014,annotate/tag (during/after reading),8,"literary annotation protocol: create annotation hashtag  ('annotag') based on ISBN, page(s)
",NA,annotation protocol,E,NA,https://twitter.com/j0_0n,394,NA,V,NA,NA,NA,NA,NA
1199,Hypothes.is,https://hypothes.is,2011,annotate/tag (during/after reading),8,"annotating, commenting and tagging tool",NA,annotation tool,O,NA,https://twitter.com/hypothes_is,5086,NA,NA,NA,V?,NA,NA,V
1350,Annotate.co,https://www.annotate.co/about.html,2014,annotate/tag (during/after reading),8,Annotate and collaborate on documents and images,NA,"annotation, also collaborative",E,NA,https://twitter.com/Annotateco,342,NA,V,NA,V,NA,NA,NA
1447,Annotated Books Online,http://www.annotatedbooksonline.com/,2012,annotate/tag (during/after reading),8,annotation platform for early modern books,NA,"annotation, also collaborative","E/O
",NA,https://twitter.com/AboBooks,2936,NA,V,NA,NA,NA,NA,NA
1351,Cochrane EMBASE screening project,http://screening.metaxis.com/EMBASE/login.php,2014,annotate/tag (during/after reading),8,classify research abstracts of RCTs in Embase  for inclusion in Cochrane CENTRAL,NA,"annotation, also collaborative",E/G,NA,no account,NA,NA,V,NA,NA,NA,NA,NA
1289,PeerLibrary,https://peerlibrary.org,2013,annotate/tag (during/after reading),8,collaborative annotating; discovery,NA,"annotation, also collaborative",O,NA,https://twitter.com/PeerLibrary,441,NA,V,NA,NA,NA,NA,NA
1448,HistoryPin,https://www.historypin.org/,2010,annotate/tag (during/after reading),8,crowdscourced community platform collaborating around history,NA,"annotation, also collaborative",E/O,NA,https://twitter.com/Historypin,12.1K,NA,V,NA,NA,NA,NA,NA
1352,Mark2Cure,https://mark2cure.org/,2014,annotate/tag (during/after reading),8,crowdsourced annotation of biochemical papers,NA,"annotation, also collaborative",E/G,NA,https://twitter.com/Mark2Cure,1426,NA,V,NA,NA,NA,NA,NA
1290,ResQuotes,http://www.resquotes.com,2013,annotate/tag (during/after reading),8,saving and organizing Kindle quotes and web text snippets,NA,"annotation, also collaborative",E,NA,no account,NA,NA,V,NA,NA,NA,NA,NA
1491,Annotation Studio,http://www.annotationstudio.org/,2013,annotate/tag (during/after reading),8,suite of collaborative web-based annotation tools (currently under development at MIT),NA,"annotation, also collaborative",E,NA,https://twitter.com/MIThyperstudio,2204,NA,V,V,V,NA,NA,NA
1620,TagTeam,http://tagteam.harvard.edu/,2012,annotate/tag (during/after reading),8,open-source tagging platform and open feed aggregator,It allows project modifying tags retroactively to manage the evolution of a standard tag vocabulary for the project topic. Each tag publishes a feed for real-time alerts. All tag records are stored for boolean searching,"annotation, also collaborative, using tags",E/O,NA,no account,NA,NA,V,NA,NA,NA,NA,NA
1499,TBE Validator service,http://www.teibyexample.org/xquery/TBEvalidator.xq,2013,experiment & collect/mine/extract data,9,web-based validator for XML-encoded text,NA,code/text validator,"E
",NA,https://twitter.com/TEIconsortium,2064,NA,NA,V,NA,NA,NA,NA
1493,Dedoose,http://www.dedoose.com/,2010,experiment & collect/mine/extract data,9,"cross-platform app for analyzing qualitative and mixed methods research with text, photos, audio, videos, spreadsheet data and more",NA,collect & visualize data,E,NA,https://twitter.com/Dedoose,1074,NA,NA,V,NA,NA,NA,NA
1293,ManyLabs,https://www.manylabs.org/,2013,experiment & collect/mine/extract data,9,tools and documentation for citizen science,NA,crowdsourced/collaborative analysis,O/E,NA,https://twitter.com/manylabs,400,NA,NA,V,NA,NA,NA,NA
1546,Morph.io,https://morph.io/,2014,experiment & collect/mine/extract data,9,automated web-scraping,NA,data extraction,E/O,NA,https://twitter.com/morph_io,255,NA,NA,NA,NA,NA,NA,NA
1166,Google NGram Viewer,https://books.google.com/ngrams,2010,experiment & collect/mine/extract data,9,chart frequencies of words/short sentences in Google Books,NA,data extraction,E,NA,no account,NA,NA,NA,V,NA,NA,NA,NA
1610,Bellingcat,https://bellingcat.checkdesk.org/en,2014,experiment & collect/mine/extract data,9,collaborative space for journalist led and citizen participating fact-checking,NA,data extraction,E,NA,https://twitter.com/bellingcat,27.3K,NA,NA,V,NA,NA,NA,NA
1296,Tabula,http://tabula.technology/,2013,experiment & collect/mine/extract data,9,extract data from pdf tables,NA,data extraction,E,NA,https://twitter.com/TabulaPDF,1338,NA,NA,V,NA,NA,NA,NA
1202,WebPlotDigitizer,http://arohatgi.info/WebPlotDigitizer/,2011,experiment & collect/mine/extract data,9,"Extract data from plots, graphs, maps etc",NA,data extraction,E,NA,https://twitter.com/ankit_rohatgi,191,NA,NA,V,NA,NA,NA,NA
1408,ScraperWiki,https://scraperwiki.com/,2009,experiment & collect/mine/extract data,9,extract/scrape tables from PDFs,NA,data extraction,E,NA,https://twitter.com/ScraperWiki,20,NA,NA,V,NA,NA,NA,NA
1059,PDF Miner,http://www.unixuser.org/~euske/python/pdfminer/index.html,2004,experiment & collect/mine/extract data,9,Extracting information from PDF documents,NA,data extraction,E,NA,no account,NA,NA,NA,V,NA,NA,NA,NA
1500,TAGS,https://tags.hawksey.info/,2010,experiment & collect/mine/extract data,9,Google Sheet template which lets you setup and run automated collection of search results from Twitter,NA,data extraction,E,NA,https://twitter.com/mhawksey,6813,NA,NA,V,NA,NA,NA,NA
1291,Import.io,https://www.import.io/,2013,experiment & collect/mine/extract data,9,"Turning web into data (scraping, parsing etc.); not restricted to scholarly use",NA,data extraction,E,NA,https://twitter.com/importio,23.1K,NA,NA,V,NA,NA,NA,NA
1498,Liquid,https://getliquid.io/,2014,experiment & collect/mine/extract data,9,mobile data collection,NA,"data form
",E,NA,https://twitter.com/LQDdata,399,NA,NA,V,NA,NA,NA,NA
1165,1degreebio,http://1degreebio.org/,2010,experiment & collect/mine/extract data,9,find reagents & lab products,NA,equipment & research samples,E,NA,https://twitter.com/1DegreeBio,4620,NA,NA,V,NA,NA,NA,NA
1019,Selectscience,http://www.selectscience.net/,1999,experiment & collect/mine/extract data,9,"independent, online review resource for lab equipment and techniques",NA,equipment & research samples,E,NA,https://twitter.com/selectscience,4095,NA,NA,V,NA,NA,NA,NA
1027,Biocompare,http://www.biocompare.com/,2000,experiment & collect/mine/extract data,9,lab equipment reviews,NA,equipment & research samples,E,NA,https://twitter.com/biocompare,3800,NA,NA,V,NA,NA,NA,NA
