ID,NAME,URL,WEBLAUNCHYEAR,PRIMEPHASEALPHA,PRIMEPHASENUMBER,FUNCTIONFREE,UI_FUNCTIONFREE,FUNCTIONCONTROLLLED,G-E-O-CATEGORY,UI_GEOCATEGORY,TWITTERACCOUNT,TWITTERFOLLOW_LATEST,ACTIVEPRE,ACTIVEDIS,ACTIVEANA,ACTIVEWRI,ACTIVEPUB,ACTIVEOUT,ACTIVEASS
1295,StrainControl,http://www.straincontrol.com/,2013,experiment & collect/mine/extract data,9,lab inventory tool,NA,equipment & research samples,E,NA,https://twitter.com/StrainControl,10,NA,NA,V,NA,NA,NA,NA
1294,Sample of Science,https://www.sampleofscience.net/,2013,experiment & collect/mine/extract data,9,Marketplace for (physical) sample sharing. Samples get published and receive DOI,NA,equipment & research samples,E/G,NA,https://twitter.com/SampleofScience,628,NA,NA,V,NA,NA,NA,NA
1058,Addgene,https://www.addgene.org/,2004,experiment & collect/mine/extract data,9,plasmid sharing platform,NA,equipment & research samples,E,NA,https://twitter.com/Addgene,4605,NA,NA,V,NA,NA,NA,NA
1356,Resource Identification Portal,https://scicrunch.com/resources,2014,experiment & collect/mine/extract data,9,"providing, discovering and citing research resources (organisms, antibodies, tools) based on RRIDs",NA,equipment & research samples,E/G,NA,no account,NA,NA,V,V,V,NA,NA,NA
1451,GeoSamples (SESAR),http://www.geosamples.org/,2004,experiment & collect/mine/extract data,9,search and register geosamples and get GEOsample ID (IGSN),NA,equipment & research samples,E,NA,https://twitter.com/igsn_info,80,NA,NA,V,NA,NA,NA,NA
1492,BioMedUSA,http://biomedusa.org/,2013,experiment & collect/mine/extract data,9,sharing and licensing of biological research materials and related technologies,NA,equipment & research samples,E,NA,no account,NA,NA,NA,V,NA,NA,NA,NA
1617,DISK,http://disk-project.org/,2016,experiment & collect/mine/extract data,9,Automated discovery of scientific knowledge (automate the hypothesize-test-evaluate discovery cycle) [login required],NA,experiment,E,NA,no account,NA,NA,V,NA,NA,NA,NA,NA
1232,GenomeCompiler,http://www.genomecompiler.com/,2012,experiment & collect/mine/extract data,9,Genetic design platform (manipulate and design everything from single genes to entire genomes),NA,experiment,E,NA,https://twitter.com/GenomeCompiler,1995,NA,NA,V,NA,NA,NA,NA
1571,Tatool,http://www.tatool.ch/,2015,experiment & collect/mine/extract data,9,Run computer based experiments (web and download),NA,experiment,E,NA,https://twitter.com/tatool_ch,74,NA,NA,V,NA,NA,NA,NA
1236,Wings,www.wings-workflows.org,2012,experiment & collect/mine/extract data,9,semantic workflow system that assists scientists with the design of computational experiments,NA,experiment,E,NA,no account,NA,NA,NA,V,NA,NA,NA,NA
1501,Emerald Cloud Lab,http://emeraldcloudlab.com,2014,experiment & collect/mine/extract data,9,web-based life sciences lab -run experiments in a central lab from anywhere in the world,NA,experiment,E,NA,https://twitter.com/emeralddna,672,NA,NA,V,NA,NA,NA,NA
1450,Eyewire,http://eyewire.org,2012,experiment & collect/mine/extract data,9,a game to map the brain (citizen science),NA,"experiment, collaborative or outsourced",E/O,NA,https://twitter.com/eye_wire,6646,NA,NA,V,NA,NA,NA,NA
1557,Notes from Nature,http://www.notesfromnature.org/,2013,experiment & collect/mine/extract data,9,Citizen Science project (Zooniverse) for transcription of with specimens from natural history museums,NA,"experiment, collaborative or outsourced",E,NA,https://twitter.com/nfromn,510,NA,NA,V,NA,NA,NA,NA
1407,Experimonths,http://science.experimonth.com/,2009,experiment & collect/mine/extract data,9,citizen science; month-long challenges to collect data,NA,"experiment, collaborative or outsourced",E,NA,https://twitter.com/experimonth,121,NA,NA,V,NA,NA,NA,NA
1167,Leukippos,http://www.leukippos.org,2010,experiment & collect/mine/extract data,9,collaborative in silico synthetic biology research in the cloud,NA,"experiment, collaborative or outsourced",O/E,NA,https://twitter.com/Socrates_Logos,NA,NA,V,V,NA,NA,NA,NA
1453,Crowdtruth,"http://crowdtruth.org/
",2013,experiment & collect/mine/extract data,9,"framework for crowdsourcing annotation data on text, images and videos",NA,"experiment, collaborative or outsourced",E,NA,https://twitter.com/CrowdTruth,2,NA,V,V,NA,NA,NA,NA
1411,CurateScience,https://curatescience.org/,2015,experiment & collect/mine/extract data,9,online platform to facilitate replication by aggregating data/syntax files and enabling curation,NA,"experiment, collaborative or outsourced",E/G,NA,https://twitter.com/curatescience,381,NA,NA,V,NA,NA,NA,NA
1410,OpenML,http://www.openml.org/,2013,experiment & collect/mine/extract data,9,"open science machine learning platform (share and collaborate on data, tasks, workflows, results)",NA,"experiment, collaborative or outsourced",O/E,NA,https://twitter.com/open_ml,70,NA,NA,V,NA,NA,NA,NA
1201,ScienceExchange,https://www.scienceexchange.com/,2011,experiment & collect/mine/extract data,9,outsourcing experiments,NA,"experiment, collaborative or outsourced",E,NA,https://twitter.com/ScienceExchange,5819,NA,NA,V,NA,NA,NA,NA
1297,Transcriptic,https://www.transcriptic.com/,2012,experiment & collect/mine/extract data,9,"remote, on-demand robotic life science research lab",NA,"experiment, collaborative or outsourced",E,NA,https://twitter.com/transcriptic,1485,NA,NA,V,NA,NA,NA,NA
1142,Quartzy,https://www.quartzy.com/,2009,experiment & collect/mine/extract data,9,"automation of lab workflow (inventory, orders, protocols, equipment scheduling)",NA,lab management,E,NA,https://twitter.com/Quartzy,1557,NA,V,V,NA,NA,NA,NA
1292,LabCritics,http://www.labcritics.com,2013,experiment & collect/mine/extract data,9,lab equipment reviews and comparisons,NA,lab management,E,NA,https://twitter.com/LabCritics,1963,NA,NA,V,NA,NA,NA,NA
1662,LabSuit,www.labsuit.com,2015,experiment & collect/mine/extract data,9,"laboratory inventory management, share with other labs",NA,lab management,E,NA,https://twitter.com/labsuit,36,NA,NA,V,NA,NA,NA,NA
1353,AssayDepot,https://www.assaydepot.com,2014,experiment & collect/mine/extract data,9,pharmaceutical marketplace for life science research services (from commercial suppliers),NA,lab management,E,NA,https://twitter.com/fasterscience,1652,NA,NA,V,NA,NA,NA,NA
1608,ELIXIR Tools and Data Services Registry,https://bio.tools/,2015,experiment & collect/mine/extract data,9,provide information about analytical tools and data services for bioinformatics,NA,lab management,E/O,NA,https://twitter.com/ELIXIREurope,1648,NA,NA,NA,NA,NA,NA,NA
1200,ELabInventory,https://www.elabinventory.com/,2011,experiment & collect/mine/extract data,9,Web-based laboratory inventory,NA,lab management,E,NA,no account,NA,NA,NA,V,NA,NA,NA,NA
1121,Laboratory Logbook,http://lablog.sourceforge.net/,2008,experiment & collect/mine/extract data,9,document and manage lab data and metadata,NA,lab notebook,E,NA,no account,NA,NA,NA,V,NA,NA,NA,NA
1233,LabFolder,https://www.labfolder.com/,2012,experiment & collect/mine/extract data,9,electronic lab notebook,NA,lab notebook,E,NA,https://twitter.com/labfolder,884,NA,V,V,NA,NA,NA,NA
1234,LabGuru,http://www.labguru.com/,2012,experiment & collect/mine/extract data,9,electronic lab notebook,NA,lab notebook,E,NA,https://twitter.com/Labguru,1915,NA,NA,V,NA,NA,NA,NA
1354,Findings App,http://findingsapp.com/,2014,experiment & collect/mine/extract data,9,electronic lab notebook (with some protocol sharing),NA,lab notebook,E,NA,https://twitter.com/FindingsApp,2263,NA,NA,V,NA,NA,NA,NA
1409,TypeForm,http://www.typeform.com,2013,experiment & collect/mine/extract data,9,create surveys,NA,online surveys,E,NA,https://twitter.com/typeform,15.4K,NA,NA,V,NA,NA,NA,NA
1168,Socialsci,https://www.socialsci.com/,2010,experiment & collect/mine/extract data,9,data collection platform: design surveys and recruit from participant pool,NA,online surveys,E,NA,https://twitter.com/socialsci,3,NA,NA,V,NA,NA,NA,NA
1235,ProProfs Form maker,http://www.proprofs.com/form/,2012,experiment & collect/mine/extract data,9,Online forms creating and hosting,NA,online surveys,E,NA,https://twitter.com/proprofs,5260,NA,NA,V,NA,NA,NA,NA
1049,Limesurvey,https://www.limeservice.com/en/,2003,experiment & collect/mine/extract data,9,Online survey creating and running,NA,online surveys,E,NA,https://twitter.com/LimeService,207,NA,NA,V,NA,NA,NA,NA
1020,SurveyMonkey,https://www.surveymonkey.com/,1999,experiment & collect/mine/extract data,9,online surveys,NA,online surveys,E,NA,https://twitter.com/SurveyMonkey,37.9K,NA,NA,V,NA,NA,NA,NA
1028,Free online Surveys,https://freeonlinesurveys.com,2000,experiment & collect/mine/extract data,9,online surveys,NA,online surveys,E,NA,no account,NA,NA,NA,V,NA,NA,NA,NA
1080,eSurveys Pro,http://www.esurveyspro.com/,2006,experiment & collect/mine/extract data,9,online surveys,NA,online surveys,E,NA,no account,NA,NA,NA,V,NA,NA,NA,NA
1081,Survey Gizmo,http://www.surveygizmo.com,2006,experiment & collect/mine/extract data,9,online surveys,NA,online surveys,E,NA,https://twitter.com/SurveyGizmo,7757,NA,NA,V,NA,NA,NA,NA
1120,FluidSurveys,http://fluidsurveys.com/,2008,experiment & collect/mine/extract data,9,online surveys,NA,online surveys,E,NA,https://twitter.com/FluidSurveys,4952,NA,NA,V,NA,NA,NA,NA
1355,Google Forms,http://www.google.com/forms/about/,2014,experiment & collect/mine/extract data,9,online surveys,NA,online surveys,E,NA,no account,NA,NA,NA,V,NA,NA,NA,NA
1497,SmartSurvey Academic,https://www.smartsurvey.co.uk/academic-research-surveys,2010,experiment & collect/mine/extract data,9,survey tool,NA,online surveys,E,NA,https://twitter.com/SmartSurvey,1063,NA,NA,V,NA,NA,NA,NA
1452,Qualtrics,http://www.qualtrics.com/,2015,experiment & collect/mine/extract data,9,web surveying tool,NA,online surveys,E,NA,https://twitter.com/Qualtrics,33.4K,NA,NA,V,NA,NA,NA,NA
1563,OpenDataKit,https://opendatakit.org/,2008,experiment & collect/mine/extract data,9,"simple mobile data collection in field, with form, cloud storage and visualisation",NA,"online surveys, mobile",E,NA,https://twitter.com/OpenDataKit,NA,NA,NA,V,NA,NA,NA,NA
1437,AllTrials,http://www.alltrials.net/,2013,experiment & collect/mine/extract data,9,campaign for preregistration of clinical trials,NA,preregistration,G,NA,no account,NA,V,NA,V,NA,V,NA,V
1436,ClinicalTrials.gov,https://clinicaltrials.gov/,2000,experiment & collect/mine/extract data,9,preregistration of clinical trials,NA,preregistration,G,NA,no account,NA,V,V,V,NA,V,NA,V
1435,Prospero,http://www.crd.york.ac.uk/PROSPERO/,2011,experiment & collect/mine/extract data,9,preregistration of systematic reviews,NA,preregistration,G,NA,https://twitter.com/crd_york,2693,V,V,V,NA,V,NA,V
1495,Prolific Academic,https://prolificacademic.co.uk/,2015,experiment & collect/mine/extract data,9,recruit participants for online studies (crowdsourcing),NA,recruit participants,E,NA,https://twitter.com/ProlificAc,NA,NA,NA,V,NA,NA,NA,NA
1496,ResearchforGood,http://www.researchforgood.com/,2011,experiment & collect/mine/extract data,9,respondent samples for surveys; donates to charities/non-profits for every completed survey,NA,recruit participants,E,NA,https://twitter.com/ResearchForGood,932,NA,NA,V,NA,NA,NA,NA
1494,Argo web based text mining,http://argo.nactem.ac.uk/,2012,experiment & collect/mine/extract data,9,web based text mining,NA,text/data mining,E,NA,no account,NA,NA,NA,V,NA,NA,NA,NA
1641,Hackuarium,http://www.hackuarium.ch/en/,2014,experiment & collect/mine/extract data,9,community and lab for biohacking,NA,open laboratory,O,NA,https://twitter.com/hackuarium,1359,NA,NA,V,NA,NA,NA,NA
1639,OpenTrials,http://opentrials.net/,2016,experiment & collect/mine/extract data,9,"locate, match, and share all publicly accessible data and documents on all clinical trials",NA,search engine for clinical trials data,O,NA,https://twitter.com/opentrials,3099,NA,V,V,NA,NA,NA,NA
1661,eagle-i,https://www.eagle-i.net,2011,experiment & collect/mine/extract data,9,sharing and discovery tool for biomedical resources,NA,overview of resources for biomedical research,E/O,NA,https://twitter.com/eagleinetwork,252,NA,V,V,NA,NA,NA,NA
1357,Docollab,https://www.docollab.com/,2014,share notebooks / protocols / workflows,10,Research project management and publication of experiments,NA,lab management,O,NA,https://twitter.com/Docollab,23,NA,NA,V,NA,V,NA,NA
1203,Sumatra,http://neuralensemble.org/sumatra/,2011,share notebooks / protocols / workflows,10,automated electronic lab notebook for computational projects - aims to aid reproducibility,NA,lab notebook,E/G,NA,no account,NA,NA,NA,V,NA,NA,NA,NA
1170,LabArchives,http://www.labarchives.com/,2010,share notebooks / protocols / workflows,10,electronic lab notebook (commercial provider); possibility to publish data publicly,NA,lab notebook,E/O,NA,https://twitter.com/LabArchives,404,NA,NA,V,NA,V?,NA,NA
1299,HiveBench,https://www.hivebench.com/,2013,share notebooks / protocols / workflows,10,electronic lab notebook with some Open protocols,NA,lab notebook,O/E,NA,https://twitter.com/hivebench,95,NA,NA,V,NA,V?,NA,NA
1073,OpenWetWare,http://openwetware.org,2005,share notebooks / protocols / workflows,10,lab notebooks and community,NA,lab notebook,O,NA,https://twitter.com/openwetware,490,NA,(V),V,NA,NA,NA,NA
1083,Open Notebook Science,http://onsnetwork.org/ or 1st: http://usefulchem.wikispaces.com/,2006,share notebooks / protocols / workflows,10,open (lab)notebook,NA,lab notebook,O,NA,https://twitter.com/ONScience,904,NA,V,V,V?,V,V,NA
1021,Protocol online,www.protocol-online.org,1999,share notebooks / protocols / workflows,10,database of research protocols,NA,research protocol searching,O/E,NA,no account,NA,NA,NA,V,NA,V?,NA,NA
1298,Benchling,https://benchling.com/,2013,share notebooks / protocols / workflows,10,"data management and collaboration platform to create, find, and discuss protocols",NA,research protocol sharing,O/E,NA,https://twitter.com/benchling,3627,NA,NA,V,NA,V?,NA,NA
1454,Scientific Protocols,https://www.scientificprotocols.org,2014,share notebooks / protocols / workflows,10,"open source, open access scientific protocols",NA,research protocol sharing,O,NA,https://twitter.com/SProtocolsOrg,516,NA,NA,V,NA,NA,NA,NA
1358,Protocols.io,https://www.protocols.io/,2014,share notebooks / protocols / workflows,10,sharing protocols,NA,research protocol sharing,O,NA,https://twitter.com/ProtocolsIO,1207,NA,(V),V,NA,V?,NA,NA
1143,Benchfly,http://www.benchfly.com/,2009,share notebooks / protocols / workflows,10,video protocols and video platform for scientists,NA,research protocol sharing,O/E,NA,https://twitter.com/BenchFly,3213,NA,NA,V,NA,V?,NA,NA
1169,Crowdlabs,http://www.crowdlabs.org/,2010,share notebooks / protocols / workflows,10,share Vistrails workflows,NA,sharing workflows,O,NA,no account,NA,NA,NA,V,NA,NA,NA,NA
1099,myExperiment,http://www.myexperiment.org/,2007,share notebooks / protocols / workflows,10,"sharing workflows, esp. in bioinformatics",NA,sharing workflows,O,Pathways zeichnen am PC,no account,NA,NA,NA,V,NA,V?,NA,NA
1082,JoVe,http://www.jove.com/,2006,share notebooks / protocols / workflows,10,Video Journal for biomedicine,NA,sharing workflows,E,NA,https://twitter.com/JoVEjournal,5421,NA,NA,V,NA,V,NA,NA
1630,RPubs,http://rpubs.com/,2012,share notebooks / protocols / workflows,10,web publishing of RMarkdown documents created in RStudio,NA,sharing workflows,E/O,NA,https://twitter.com/RPubsRecent,420,NA,NA,V,NA,V,NA,NA
1171,OpenRefine (formerly Google Refine),http://openrefine.org/,2010,analyze,11,"cleaning and transforming data, extending data with other data from web services",NA,analysis platform/code,E/O,NA,https://twitter.com/OpenRefine,2690,NA,NA,V,NA,NA,NA,NA
1360,DHbox,http://dhbox.org/,2014,analyze,11,"cloud-based digital humanities lab, pre-equipped w/ IPython, RStudio, Omeka, and NLTK.",NA,analysis platform/code,E,NA,https://twitter.com/DH_Box,443,NA,NA,V,NA,NA,NA,NA
1060,Kepler,https://kepler-project.org/,2004,analyze,11,"create, execute, and share models and analyses; environment for integrating disparate software components",NA,analysis platform/code,E/O,NA,https://twitter.com/ProjectKepler,6,NA,NA,V,NA,NA,NA,NA
1300,Appsoma,https://appsoma.com,2013,analyze,11,"developing, running  and publishing code for science applications",NA,analysis platform/code,E,NA,https://twitter.com/Appsoma,9,NA,NA,V,NA,V?,NA,NA
1609,Kaggle Datasets,https://kaggle.com/datasets,2016,analyze,11,discover and analyse public datasets [part of Kaggle],NA,analysis platform/code,O/E,NA,https://twitter.com/kaggle,67.2K,NA,NA,V,NA,V,NA,NA
1204,iPython Notebook (now Jupyter Notebook),http://ipython.org/notebook.html,2011,analyze,11,"editing document format that allows combination of executable code, txt, mathematics, plots and media; parallel computing",NA,analysis platform/code,E,NA,https://twitter.com/IPythonDev,10.5K,NA,NA,V,V?,NA,NA,NA
1144,GenePattern,http://www.broadinstitute.org/cancer/software/genepattern/,2009,analyze,11,genomic analysis platform that provides access to hundreds of genomics tools.,NA,analysis platform/code,E,NA,https://twitter.com/GenePattern,485,NA,NA,V,NA,NA,NA,NA
1572,Google Cloud Datalab,https://cloud.google.com/datalab/,2015,analyze,11,interactive tool/platform  for exploring and visualizing data,NA,analysis platform/code,E/O,NA,no account,NA,NA,NA,V,(V),NA,NA,NA
1502,Jupyter,http://jupyter.org/,2015,analyze,11,Multi-language interactive computing environments - the future home of IPython notebook and related language-agnostic projects,NA,analysis platform/code,E,NA,https://twitter.com/ProjectJupyter,12.2K,NA,NA,V,V?,NA,NA,NA
1412,Galaxy,https://galaxyproject.org/,2005,analyze,11,"online data manipulation and analysis, for biomedical research but in principle field agnostic",NA,analysis platform/code,O/E,NA,https://twitter.com/galaxyproject,5359,NA,NA,V,NA,NA,NA,NA
1237,ROpenSci,http://ropensci.org/,2012,analyze,11,packages to connect data/literature/metric/visualization etc. repositories/search engines to R using APIs,NA,analysis platform/code,E,NA,https://twitter.com/rOpenSci,12K,NA,V,V,NA,NA,NA,NA
1012,Kitware,http://www.kitware.com,1996,analyze,11,software solutions (many open-source) and support services for data-intensive R&D,NA,analysis platform/code,E/O,NA,https://twitter.com/Kitware,2029,NA,NA,V,NA,NA,NA,NA
1301,Arvados,http://www.arvados.org/,2013,analyze,11,Virtual environment enabling reproducibility of data analysis with versioned scripts and tools,NA,analysis platform/code,G,NA,https://twitter.com/arvados,173,NA,NA,V,NA,NA,NA,NA
1063,Statcrunch,http://www.statcrunch.com/,2004,analyze,11,web-based data analysis,NA,analysis platform/code,E,NA,https://twitter.com/statcrunch,356,NA,NA,V,NA,NA,NA,NA
1238,Wakari,https://wakari.io/,2012,analyze,11,web-based python data analysis,NA,analysis platform/code,E,NA,no account,NA,NA,NA,V,NA,NA,NA,NA
1145,Voyeur/Voyant tools,http://voyant-tools.org/,2009,analyze,11,web-based text analysis environment,NA,analysis platform/code,E/O,NA,https://twitter.com/VoyantTools,804,NA,NA,V,NA,NA,NA,NA
1062,Pegasus,https://pegasus.isi.edu/,2004,analyze,11,workflow management platform that helps workflow-based applications execute,NA,analysis platform/code,E,NA,no account,NA,NA,NA,V,NA,NA,NA,NA
1633,Statcheck,http://statcheck.io/,2016,analyze,11,check a PDF or HTML file for errors in statistical reporting,NA,checking statistical reporting,G/E,NA,no account,NA,NA,NA,V,NA,NA,NA,V
1043,BOINC,http://boinc.berkeley.edu/,2002,analyze,11,open source software for volunteer and grid computing,NA,collaboative computing,O/E,NA,https://twitter.com/BOINCprojects,3578,NA,NA,V,NA,NA,NA,NA
1029,Folding@home,http://folding.stanford.edu/,2000,analyze,11,"Distributed computing project which studies protein folding, misfolding, aggregation, and related diseases",NA,collaborative computing,O/E,NA,https://twitter.com/foldingathome,2241,NA,NA,V,NA,NA,NA,NA
1061,Open Science Grid,http://www.opensciencegrid.org/,2004,analyze,11,software to support collaborative computing,NA,collaborative computing,E,NA,https://twitter.com/opensciencegrid,177,NA,NA,V,NA,NA,NA,NA
1172,Project Noah,http://www.projectnoah.org/,2010,analyze,11,citizen science (studying wildlife),NA,crowdsourced/collaborative analysis,O,NA,https://twitter.com/projectnoah,9074,NA,NA,V,NA,NA,NA,NA
1457,Socientize,http://www.socientize.eu,2012,analyze,11,citizen science network for infrastructure providers and researchers to recruit participants,NA,crowdsourced/collaborative analysis,E,NA,https://twitter.com/SOCIENTIZE,919,(V),NA,V,NA,NA,NA,NA
1456,Foldit,http://fold.it/,2008,analyze,11,citizen science project in protein folding,NA,crowdsourced/collaborative analysis,E,NA,https://twitter.com/Foldit,1262,NA,NA,V,NA,NA,NA,NA
1304,Snapzen,https://snapzen.com/screen-capture,2013,analyze,11,collaboratively discuss / analyze screen captures,NA,crowdsourced/collaborative analysis,G,NA,https://twitter.com/SnapzenCo,1887,NA,V,V,NA,NA,NA,NA
1101,Zooniverse,https://www.zooniverse.org/,2007,analyze,11,crowdsourced analysis (citizen science),NA,crowdsourced/collaborative analysis,O/E,NA,https://twitter.com/the_zooniverse,15.8K,NA,NA,V,NA,NA,NA,NA
1022,SETI@home,https://seti.berkeley.edu/,1999,analyze,11,crowdsourced computer power for analysis (citizen science); finding intelligent life outside earth,NA,crowdsourced/collaborative analysis,E,NA,https://twitter.com/setiathome,53,NA,NA,V,NA,NA,NA,NA
1100,Galaxy Zoo (part of Zooniverse),http://www.galaxyzoo.org/,2007,analyze,11,crowdsourced science,NA,crowdsourced/collaborative analysis,E,NA,https://twitter.com/galaxyzoo,13.2K,NA,NA,V,NA,NA,NA,NA
1359,Crowdfindings,http://www.crowdedtheory.com/,2014,analyze,11,Crowdsourced social science analysis,NA,crowdsourced/collaborative analysis,E/O,NA,no account,NA,NA,NA,V,NA,NA,NA,NA
1205,SciStarter,http://scistarter.com/,2011,analyze,11,database of citizen science projects,NA,crowdsourced/collaborative analysis,E/O,NA,https://twitter.com/SciStarter,8561,NA,V?,V,NA,NA,NA,NA
1455,Polymath,http://michaelnielsen.org/polymath1/,2009,analyze,11,massively collaborative online mathematical projects,NA,crowdsourced/collaborative analysis,E/G,NA,no account,NA,"(V)
",NA,V,NA,NA,NA,NA
1434,Crowdcrafting,http://crowdcrafting.org/,2011,analyze,11,online tool for making crowdsourcing projects,NA,crowdsourced/collaborative analysis,E,NA,https://twitter.com/crowdcrafting,785,V,NA,V,NA,NA,NA,NA
1362,Synapse (Sage),https://www.synapse.org/,2014,analyze,11,"platform for ""open collaborative data analysis""",NA,crowdsourced/collaborative analysis,G,NA,https://twitter.com/sagebio,3945,NA,NA,V,NA,NA,NA,NA
1302,GCAT,http://www.bioplanet.com/gcat,2013,analyze,11,share and compare results of different analysis tools on same datasets,NA,crowdsourced/collaborative analysis,G,NA,no account,NA,NA,NA,V,NA,NA,NA,NA
1541,Nomenklatura,http://nomenklatura.okfnlabs.org/,2012,analyze,11,data cleaning - alias reconciliation,NA,data cleaning,E,NA,no account,NA,NA,NA,V,NA,NA,NA,NA
1303,Plasmid.io,http://www.shazino.com/#plasmidio,2013,analyze,11,Manage plasmids,NA,lab management,E,NA,https://twitter.com/Plasmid_io,27,NA,NA,V,NA,NA,NA,NA
1361,Riffyn,http://riffyn.com/,2014,analyze,11,Process design and analysis software for reproducible research and development,NA,process management,G/E,NA,https://twitter.com/riffyn,308,NA,NA,V,NA,NA,NA,NA
1642,Opendatafit,http://opendatafit.org/,2016,analyze,11,"open source tools and information to collect, fit (model) and store experimental data (esp. biomedicine)",NA,analysis platform/code,E/O,NA,https://twitter.com/opendatafit,194,NA,NA,V,NA,NA,NA,NA
1415,QIword,https://qiword.co/,2014,visualize,12,Analyze keyword interaction from a library of papers,NA,create graphs,E,NA,https://twitter.com/qiword_official/,434,NA,NA,V,NA,NA,NA,NA
1503,Debategraph,http://debategraph.org,2008,visualize,12,cloud based platform for mapping and supporting debates,NA,create graphs,E/O,NA,https://twitter.com/DebateGraph,3570,NA,NA,V,NA,NA,NA,NA
1611,Datahero,https://datahero.com/,2011,visualize,12,cloud-based data analysis and visualization (charts and dashboards),NA,create graphs,E,NA,https://twitter.com/datahero,1692,NA,NA,NA,V,NA,NA,NA
1239,Plot.ly,https://plot.ly,2012,visualize,12,create graphs (collaboratively),NA,create graphs,E,NA,https://twitter.com/plotlygraphs,57.7K,NA,NA,V,V,NA,NA,NA
1122,Google Charts,https://developers.google.com/chart/,2008,visualize,12,create live and interactive charts in your browser,NA,create graphs,E,NA,no account,NA,NA,NA,V,V,NA,NA,NA
1414,Datawrapper,https://datawrapper.de/,2012,visualize,12,creating charts and maps online,NA,create graphs,E,NA,https://twitter.com/Datawrapper,2787,NA,NA,V,V,NA,NA,NA
1050,Tableau,http://www.tableau.com/,2003,visualize,12,data visualization software (also online),NA,create graphs,E,NA,https://twitter.com/tableau,99.9K,NA,NA,V,V,NA,NA,NA
1146,Google Fusion Tables,https://support.google.com/fusiontables/answer/2571232,2009,visualize,12,"data visualization web application to gather, visualize, and share data tables",NA,create graphs,E,NA,https://twitter.com/GoogleFT,11.3K,NA,NA,V,V,NA,NA,NA
1504,Timeline.js,http://timeline.knightlab.com/,2013,visualize,12,interactive timeline visualizations,NA,create graphs,E,NA,https://twitter.com/TimelineJS,1210,NA,NA,V,V,NA,NA,NA
1173,Circos table viewer,http://mkweb.bcgsc.ca/tableviewer/,2010,visualize,12,Online application of Circos to visualize tabular data,NA,create graphs,E,NA,no account,NA,NA,NA,V,V,NA,NA,NA
1363,Lynks,https://lynksoft.com/,2014,visualize,12,online networks visualization,NA,create graphs,E,NA,no account,NA,NA,NA,V,NA,NA,NA,NA
1305,Raw,http://raw.densitydesign.org/,2013,visualize,12,Open web app to create custom vector-based visualizations using D3.js library,NA,create graphs,E,NA,https://twitter.com/densitydesign,7811,NA,NA,V,V,NA,NA,NA
1505,TAGS Explorer,http://hawksey.info/tagsexplorer/,2011,visualize,12,visualize Twitter networks (based on TAGS),NA,create graphs,E,NA,https://twitter.com/mhawksey,6813,NA,NA,V,NA,NA,NA,NA
